Game,Console,Name,Developer,Total Shipped,Total Sales,NA Sales,PAL Sales,Japan Sales,Other Sales,Release Date,Last Update,rating,ratings_count,metacritic,genres,platforms
PS3_Planet 51PS4_Hatsune Miku: Project Diva XPS3_Thor: God of ThunderPS4_Valkyria RevolutionPS3_StormrisePS3_Full Auto 2: BattlelinesPS3_Dengeki Bunko Fighting ClimaxPS3_Armored Core 4PS3_Captain America: Super SoldierPS3_Anarchy ReignsPS3_The ClubPS4_Valkyria Chronicles 4PS3_The Incredible HulkPS3_Hatsune Miku: Project Diva F 2ndPS4_Shenmue I & IIPS3_Next Hatsune Miku: Project DivaPS3_The Golden CompassPS4_Sonic ManiaPS3_Golden Axe: Beast RiderPS4_Valkyria Chronicles RemasteredPS3_Alien: IsolationPS3_Binary DomainPS3_Vancouver 2010 - The Official Video Game of the Olympic Winter GamesPS4_Sega Genesis ClassicsPS4_Fist of The North Star: Lost ParadisePS3_The House of the Dead: Overkill - Extended CutPS4_Yakuza: Kiwami 2PS3_Virtua Tennis 2009PS3_Viking: Battle for AsgardPS3_Iron Man 2PS3_Condemned 2: BloodshotPS3_Sega Superstars TennisPS3_Alpha ProtocolPS4_Yakuza KiwamiPS3_Virtua Tennis 4PS3_Sonic & Sega All-Stars Racing TransformedPS4_Sonic ForcesPS3_VanquishPS3_Sega Rally RevoPS3_Aliens: Colonial MarinesPS4_Yakuza ZeroPS3_London 2012: The Official Video Game of the Olympic GamesPS3_Iron ManPS4_Yakuza 6: The Song of LifePS3_Resonance of FatePS3_Beijing 2008PS3_Sonic & SEGA All-Stars RacingPS3_Sonic UnleashedPS3_Aliens vs PredatorPS3_Virtua Tennis 3PS3_Virtua Fighter 5PS4_Alien: IsolationPS3_BayonettaPS3_Sonic GenerationsPS3_Sonic's Ultimate Genesis Collection,PS3PS4PS3PS4PS3PS3PS3PS3PS3PS3PS3PS4PS3PS3PS4PS3PS3PS4PS3PS4PS3PS3PS3PS4PS4PS3PS4PS3PS3PS3PS3PS3PS3PS4PS3PS3PS4PS3PS3PS3PS4PS3PS3PS4PS3PS3PS3PS3PS3PS3PS3PS4PS3PS3PS3,Planet 51Hatsune Miku: Project Diva XThor: God of ThunderValkyria RevolutionStormriseFull Auto 2: BattlelinesDengeki Bunko Fighting ClimaxArmored Core 4Captain America: Super SoldierAnarchy ReignsThe ClubValkyria Chronicles 4The Incredible HulkHatsune Miku: Project Diva F 2ndShenmue I & IINext Hatsune Miku: Project DivaThe Golden CompassSonic ManiaGolden Axe: Beast RiderValkyria Chronicles RemasteredAlien: IsolationBinary DomainVancouver 2010 - The Official Video Game of the Olympic Winter GamesSega Genesis ClassicsFist of The North Star: Lost ParadiseThe House of the Dead: Overkill - Extended CutYakuza: Kiwami 2Virtua Tennis 2009Viking: Battle for AsgardIron Man 2Condemned 2: BloodshotSega Superstars TennisAlpha ProtocolYakuza KiwamiVirtua Tennis 4Sonic & Sega All-Stars Racing TransformedSonic ForcesVanquishSega Rally RevoAliens: Colonial MarinesYakuza ZeroLondon 2012: The Official Video Game of the Olympic GamesIron ManYakuza 6: The Song of LifeResonance of FateBeijing 2008Sonic & SEGA All-Stars RacingSonic UnleashedAliens vs PredatorVirtua Tennis 3Virtua Fighter 5Alien: IsolationBayonettaSonic GenerationsSonic's Ultimate Genesis Collection,"Pyro StudiosSegaLiquid EntertainmentMedia.VisionThe Creative AssemblyPseudo InteractiveSegaFrom SoftwareNext Level GamesPlatinumGamesBizarre CreationsSegaEdge of RealitySegaSegaSegaShiny EntertainmentPagodaWest GamesSecret LevelSegaCreative AssemblyAmusement VisionEurocom Entertainment SoftwareSegaSegaHeadstrong GamesSegaSumo DigitalThe Creative AssemblySega Studios, San FranciscoMonolith ProductionsSumo DigitalObsidian EntertainmentSegaSega-AM2Sumo DigitalSonic TeamPlatinumGamesSega Racing StudioGearbox SoftwareSegaSega Studios AustraliaSecret LevelSegatri-AceEurocom Entertainment SoftwareSumo DigitalSonic TeamRebellion DevelopmentsSega-AM3Sega-AM2Creative AssemblyPlatinumGamesSonic TeamBackbone Entertainment",800000.0,28860000.0,10290000.0,11360000.0,2980000.0,4280000.0,2009-11-172016-08-302011-05-032017-06-272009-03-242006-12-072015-10-062007-03-202011-07-192013-01-082008-02-192018-09-252008-06-052014-11-182018-08-212013-08-272007-12-042017-08-152008-10-142016-05-172014-10-072012-02-282010-01-122018-05-292018-10-022011-10-252018-08-282009-06-092008-03-252010-05-042008-03-112008-03-182010-06-012017-08-292011-05-102012-11-182017-11-072010-10-192007-10-092013-02-122017-01-242012-06-262008-05-022018-04-172010-03-162008-07-082010-02-232008-12-092010-02-162007-03-202007-02-202014-10-072010-01-052011-11-012009-02-10,2018-06-302018-01-212018-06-192018-12-192018-08-152018-09-112018-09-222018-09-112018-01-072018-01-032018-02-112018-01-262018-01-032018-01-05,117.92,8386.0,2156.0,"Arcade, Racing, Adventure, ActionAdventure, ActionStrategy, ActionRacing, ArcadeShooter, Adventure, Action, SimulationAdventure, ActionAction, FightingStrategy, Action, RPGAdventure, Action, RPG, SimulationCasual, Platformer, Adventure, ActionAdventure, ActionShooter, ActionSportsAdventure, Action, RPG, Fighting, Arcade, PlatformerAdventure, ActionSportsAdventure, Action, RPG, FightingAdventure, ActionShooter, Action, FightingFamily, SportsShooter, Action, RPGAdventure, Action, RPG, FightingSportsPlatformer, Adventure, ActionIndie, Shooter, Adventure, ActionShooter, ActionShooter, Adventure, ActionRPGRacingArcade, Adventure, ActionSportsArcade, FightingAdventure, ActionAdventure, ActionFamily, Platformer, Arcade, ActionCasual, Platformer, Adventure","PC, Nintendo DS, Xbox 360, PlayStation 3, WiiPlayStation 4, PS VitaNintendo 3DS, Nintendo DS, Xbox 360, PlayStation 3, WiiPC, Xbox 360, PlayStation 3PlayStation 3, PSPXbox 360, PlayStation 3Nintendo 3DS, Nintendo DS, Xbox 360, PlayStation 3, WiiXbox 360, PlayStation 3PC, Xbox One, PlayStation 4, Nintendo SwitchPC, Xbox One, PlayStation 4PC, Xbox One, PlayStation 4, Nintendo SwitchXbox 360, PlayStation 3PC, Xbox 360, PlayStation 3PC, Xbox 360, PlayStation 3PC, Xbox One, PlayStation 4, Nintendo Switch, macOS, LinuxPlayStation 5, PlayStation 4PC, Xbox 360, PlayStation 3, WiiPC, Xbox 360, PlayStation 3iOS, Nintendo DS, Xbox 360, PlayStation 3, PlayStation 2, PSP, WiiXbox 360, PlayStation 3Nintendo DS, macOS, Xbox 360, PlayStation 3, PlayStation 2, WiiPC, Xbox 360, PlayStation 3PC, Xbox One, PlayStation 4, Nintendo Switch, PlayStation 3PC, PlayStation 3, PS Vita, WiiPC, Xbox One, PlayStation 4, Nintendo Switch, iOS, AndroidPC, Xbox One, Xbox 360, PlayStation 3PC, Xbox 360, PlayStation 3PC, Xbox One, PlayStation 4Xbox 360, PlayStation 3PC, iOS, Android, Nintendo DS, Xbox 360, PlayStation 3, WiiXbox One, Xbox 360, PlayStation 3, PlayStation 2, WiiPC, Xbox 360, PlayStation 3, PSPXbox 360, PlayStation 3PC, Xbox One, PlayStation 4, Nintendo Switch, iOS, AndroidPC, PlayStation 4, Xbox One, Nintendo Switch, Xbox 360, PlayStation 3, Wii UPC, Xbox One, PlayStation 4, Nintendo 3DS, Xbox 360, PlayStation 3Xbox 360, PlayStation 3"
PS3_TimeShiftPS3_Robert Ludlum's The Bourne Conspiracy,PS3PS3,TimeShiftRobert Ludlum's The Bourne Conspiracy,Saber InteractiveHigh Moon Studios,0.0,550000.0,320000.0,140000.0,0.0,80000.0,2007-11-192008-06-03,0,7.109999999999999,328.0,141.0,"Indie, Shooter, Adventure, ActionShooter, Adventure, Action","PC, Xbox 360, PlayStation 3Xbox 360, PlayStation 3"
PS4_Overcooked! 2PS4_The Escapists 2,PS4PS4,Overcooked! 2The Escapists 2,Ghost Town GamesTeam17 Software,0.0,400000.0,110000.0,220000.0,0.0,70000.0,2018-08-072017-08-22,2018-06-142019-02-22,7.710000000000001,1068.0,156.0,"Casual, Indie, ActionStrategy, Indie, Simulation","PC, Xbox One, PlayStation 4, Nintendo Switch, macOS, LinuxPC, Xbox One, PlayStation 4, Nintendo Switch, macOS, Linux"
PS3_SingStar LatinoPS3_ESA Game PackPS3_Everybody DancePS3_High Velocity BowlingPS3_NBA 09: The InsidePS3_PlayStation Move HeroesPS3_EyePet & FriendsPS4_Gravity Rush RemasteredPS3_Kung Fu RiderPS3_Carnival IslandPS4_Tearaway UnfoldedPS3_Ratchet & Clank: Full Frontal AssaultPS3_TV SuperstarsPS3_NBA 07PS3_Medieval Moves: Deadmund's QuestPS3_SorceryPS3_FolklorePS3_StarhawkPS3_MLB 07: The ShowPS3_The ShootPS3_The Eye of JudgmentPS3_Twisted MetalPS3_SingStar QueenPS3_MotorStorm: ApocalypsePS3_LairPS3_SingStar DancePS3_Sly Cooper: Thieves in TimePS3_The Fight: Lights OutPS3_MLB 11: The ShowPS3_Start the Party!PS3_LittleBigPlanet 3PS3_Book of SpellsPS3_The Sly CollectionPS3_MLB 08: The ShowPS3_MLB 09: The ShowPS3_MLB 10: The ShowPS4_MLB 14 The ShowPS3_Genji: Days of the BladePS3_Ratchet & Clank CollectionPS3_SingStar Vol. 2PS3_Twisted Metal (2012)PS3_LittleBigPlanet KartingPS3_Buzz! Quiz TVPS3_God of War SagaPS4_God of War III RemasteredPS3_SOCOM 4: U.S. Navy SEALsPS3_BUZZ! Quiz WorldPS3_SingStar AbbaPS3_Jak and Daxter CollectionPS3_White Knight Chronicles: International EditionPS3_PlayStation All-Stars Battle RoyalePS3_EyePetPS3_WarhawkPS3_ModNation RacersPS3_SingStarPS3_Hot Shots Golf: Out of BoundsPS3_SOCOM: U.S. Navy SEALs ConfrontationPS3_MAG: Massive Action GamePS3_The ICO & Shadow of the Colossus CollectionPS4_The Order: 1886PS3_inFAMOUS 2PS4_KnackPS4_Until DawnPS4_LittleBigPlanet 3PS4_DriveclubPS3_Killzone 3PS4_inFAMOUS: Second SonPS4_Killzone: Shadow FallPS4_BloodbornePS3_LittleBigPlanet 2PS3_Sports ChampionsPS3_Uncharted: Drake's FortunePS4_Uncharted: The Nathan Drake CollectionPS4_MinecraftPS3_Uncharted 2: Among ThievesPS4_The Last of Us Remastered,PS3PS3PS3PS3PS3PS3PS3PS4PS3PS3PS4PS3PS3PS3PS3PS3PS3PS3PS3PS3PS3PS3PS3PS3PS3PS3PS3PS3PS3PS3PS3PS3PS3PS3PS3PS3PS4PS3PS3PS3PS3PS3PS3PS3PS4PS3PS3PS3PS3PS3PS3PS3PS3PS3PS3PS3PS3PS3PS3PS4PS3PS4PS4PS4PS4PS3PS4PS4PS4PS3PS3PS3PS4PS4PS3PS4,SingStar LatinoESA Game PackEverybody DanceHigh Velocity BowlingNBA 09: The InsidePlayStation Move HeroesEyePet & FriendsGravity Rush RemasteredKung Fu RiderCarnival IslandTearaway UnfoldedRatchet & Clank: Full Frontal AssaultTV SuperstarsNBA 07Medieval Moves: Deadmund's QuestSorceryFolkloreStarhawkMLB 07: The ShowThe ShootThe Eye of JudgmentTwisted MetalSingStar QueenMotorStorm: ApocalypseLairSingStar DanceSly Cooper: Thieves in TimeThe Fight: Lights OutMLB 11: The ShowStart the Party!LittleBigPlanet 3Book of SpellsThe Sly CollectionMLB 08: The ShowMLB 09: The ShowMLB 10: The ShowMLB 14 The ShowGenji: Days of the BladeRatchet & Clank CollectionSingStar Vol. 2Twisted Metal (2012)LittleBigPlanet KartingBuzz! Quiz TVGod of War SagaGod of War III RemasteredSOCOM 4: U.S. Navy SEALsBUZZ! Quiz WorldSingStar AbbaJak and Daxter CollectionWhite Knight Chronicles: International EditionPlayStation All-Stars Battle RoyaleEyePetWarhawkModNation RacersSingStarHot Shots Golf: Out of BoundsSOCOM: U.S. Navy SEALs ConfrontationMAG: Massive Action GameThe ICO & Shadow of the Colossus CollectionThe Order: 1886inFAMOUS 2KnackUntil DawnLittleBigPlanet 3DriveclubKillzone 3inFAMOUS: Second SonKillzone: Shadow FallBloodborneLittleBigPlanet 2Sports ChampionsUncharted: Drake's FortuneUncharted: The Nathan Drake CollectionMinecraftUncharted 2: Among ThievesThe Last of Us Remastered,SCEE London StudioVariousSCEE London StudioTeam RamrodSCE San Diego StudioNihilistic SoftwareSCEE London StudioBluepoint GamesSCE Japan StudioMagic Pixel GamesMedia MoleculeInsomniac GamesSCEE CambridgeSCE San Diego StudioZindagi GamesThe WorkshopGame RepublicLightBox InteractiveSCE San Diego StudioCohort StudiosSCE Japan StudioEat Sleep PlaySCEE London StudioEvolution StudiosFactor 5SCEE London StudioSanzaru GamesColdWood InteractiveSCEA San Diego StudiosSupermassive Games Ltd.Sumo DigitalSCEE London StudioSanzaru GamesSCE San Diego StudioSCE San Diego StudioSCEA San Diego StudiosSCE San Diego StudioGame RepublicIdol MindsSCEE London StudioEat Sleep PlayUnited Front GamesRelentless SoftwareSCEA Santa Monica StudioSCEA Santa Monica StudioZipper InteractiveMagenta SoftwareSCEE London StudioNaughty DogLevel 5SuperBot EntertainmentSCEE London StudioIncognito EntertainmentUnited Front GamesSCEE London StudioClap HanzSlant Six GamesZipper InteractiveBluepoint GamesReady at DawnSucker Punch ProductionsSCE Japan StudioSupermassive Games Ltd.Sumo DigitalEvolution StudiosGuerrilla GamesSucker PunchGuerrilla GamesFrom SoftwareMedia MoleculeSCE San Diego StudioNaughty DogBluepoint GamesMojangNaughty DogNaughty Dog,64830000.0,97590000.0,44590000.0,34560000.0,4180000.0,14250000.0,2009-11-172010-11-102011-10-182010-09-212008-10-072011-03-222011-11-152016-02-022010-09-172011-11-152015-09-082012-11-272010-10-122006-11-142011-11-152012-05-222007-10-092012-05-082007-05-152010-10-262007-10-242012-02-142009-08-042011-05-032007-08-302010-11-092013-02-052010-11-092011-03-082010-09-072014-11-182012-11-132010-11-092008-03-042009-03-032010-03-022014-05-062006-11-142012-08-282008-10-282012-02-142012-11-062008-09-232012-08-282015-07-142011-04-192009-11-102008-12-022012-02-072010-02-022012-11-202010-09-172007-08-282010-05-252008-05-202008-03-182008-10-142010-01-262011-09-272015-02-202011-06-072013-11-152015-08-252014-11-182014-10-072011-02-222014-03-212013-11-152015-03-242011-01-182010-09-172007-11-162015-10-072014-10-072009-10-132014-07-29,2018-09-232018-11-272018-03-162018-12-032018-01-022018-09-172018-09-142018-04-032018-09-252018-11-022018-04-142018-04-102018-09-142018-09-24,161.28,21212.0,1988.0,"ArcadeArcade, Simulation, SportsActionFamilyActionArcadeArcadeFamily, Adventure, ActionStrategy, PlatformerArcadeArcade, Adventure, ActionAdventure, ActionAction, RPGShooter, Strategy, ActionSportsArcadeRacing, Arcade, ActionRacing, ArcadeActionArcadeArcade, AdventureArcade, FightingArcadePlatformer, Adventure, PuzzleAdventure, RPG, Casual, Arcade, IndieArcade, Adventure, ActionSportsSportsSportsAdventure, ActionArcade, ActionRacing, Arcade, ActionCasual, FamilyAdventure, ActionAdventure, ActionShooter, ActionFamily, ArcadeArcade, Adventure, ActionFamily, Massively Multiplayer, Arcade, FightingFamilyShooter, Action, SimulationRacing, Arcade, ActionShooter, ActionAdventure, ActionAdventure, ActionAdventure, ActionActionAdventure, ActionPlatformer, Adventure, PuzzleRacingShooter, ActionAction, RPGArcade, ActionCasual, Arcade, SportsShooter, ActionAction, Arcade, Simulation, Indie, Massively MultiplayerShooter, ActionAdventure, Action","PlayStation 3PlayStation 3PlayStation 3PlayStation 3PlayStation 4PlayStation 3PlayStation 3PlayStation 4PlayStation 3, PS VitaPlayStation 3PlayStation 3PlayStation 3PlayStation 3PlayStation 3PlayStation 3, PlayStation 2PlayStation 3PlayStation 3PlayStation 3PlayStation 3PlayStation 3PlayStation 3PlayStation 3, PS VitaPlayStation 3PlayStation 3PlayStation 4, PlayStation 3PC, PlayStation 3PlayStation 3, PS VitaPlayStation 3, PlayStation 2PlayStation 3, PlayStation 2PlayStation 3, PlayStation 2PlayStation 3PlayStation 3, PS VitaPlayStation 3PlayStation 3PlayStation 3PlayStation 4PlayStation 3PlayStation 3PlayStation 3, PlayStation 2PlayStation 3, PS VitaPlayStation 3, PS VitaPlayStation 3PC, PlayStation 3PlayStation 3PlayStation 4, PlayStation 3PlayStation 3PlayStation 3PlayStation 4PlayStation 3PlayStation 4PlayStation 4, PlayStation 3PlayStation 4, PlayStation 3PlayStation 4PlayStation 3PlayStation 4PlayStation 3PlayStation 3PlayStation 4, PlayStation 3PC, Xbox One, PlayStation 4, Nintendo Switch, iOS, Android, Nintendo 3DS, macOS, Linux, Xbox 360, PlayStation 3, PS Vita, Wii UPlayStation 4, PlayStation 3PlayStation 4"
PS3_PuppeteerPS3_MLB 16: The ShowPS3_MLB 15: The ShowPS3_MLB 14 The ShowPS3_MLB 13: The ShowPS3_MLB 12: The ShowPS4_MLB 16: The ShowPS4_MLB 15: The ShowPS3_Minecraft,PS3PS3PS3PS3PS3PS3PS4PS4PS3,PuppeteerMLB 16: The ShowMLB 15: The ShowMLB 14 The ShowMLB 13: The ShowMLB 12: The ShowMLB 16: The ShowMLB 15: The ShowMinecraft,SCE Japan StudioSCE San Diego StudioSCE San Diego StudioSCE San Diego StudioSCE San Diego StudioSCE San Diego StudioSCE San Diego StudioSCE San Diego StudioMojang,0.0,11270000.0,6360000.0,3040000.0,20000.0,1860000.0,2013-09-102016-03-292015-03-312014-04-012013-03-052012-03-062016-03-292015-03-312014-05-16,2018-04-202018-05-01,22.89,3222.0,323.0,"Platformer, ActionSportsSportsSportsSportsSportsAction, Arcade, Simulation, Indie, Massively Multiplayer","PlayStation 3PlayStation 4, PlayStation 3PlayStation 4, PlayStation 3, PS VitaPlayStation 3PlayStation 4, PlayStation 3PlayStation 4, PlayStation 3, PS VitaPC, Xbox One, PlayStation 4, Nintendo Switch, iOS, Android, Nintendo 3DS, macOS, Linux, Xbox 360, PlayStation 3, PS Vita, Wii U"
PS4_Job SimulatorPS4_The InpatientPS4_BattlezonePS4_Creed: Rise to GloryPS4_EVE: ValkyriePS4_RIGS: Mechanized Combat LeaguePS4_SingStar CelebrationPS4_Tetris EffectPS4_Bravo TeamPS4_Driveclub VRPS4_Robinson: The JourneyPS4_PlayerUnknown's BattlegroundsPS4_Gravity Rush 2PS4_Firewall: Zero HourPS4_Knack 2PS4_Everybody's GolfPS4_Hidden AgendaPS4_Knowledge is PowerPS4_Astro Bot Rescue MissionPS4_WipEout Omega CollectionPS4_Until Dawn: Rush of BloodPS4_NiohPS4_MLB The Show 18PS4_MLB The Show 17PS4_Shadow of the ColossusPS4_The Last GuardianPS4_Detroit: Become HumanPS4_PlayStation VR WorldsPS4_Uncharted: The Lost LegacyPS4_Ratchet & Clank (2016)PS4_Gran Turismo SportPS4_Horizon: Zero DawnPS4_God of War (2018)PS4_Marvel's Spider-ManPS4_Uncharted 4: A Thief's End,PS4PS4PS4PS4PS4PS4PS4PS4PS4PS4PS4PS4PS4PS4PS4PS4PS4PS4PS4PS4PS4PS4PS4PS4PS4PS4PS4PS4PS4PS4PS4PS4PS4PS4PS4,Job SimulatorThe InpatientBattlezoneCreed: Rise to GloryEVE: ValkyrieRIGS: Mechanized Combat LeagueSingStar CelebrationTetris EffectBravo TeamDriveclub VRRobinson: The JourneyPlayerUnknown's BattlegroundsGravity Rush 2Firewall: Zero HourKnack 2Everybody's GolfHidden AgendaKnowledge is PowerAstro Bot Rescue MissionWipEout Omega CollectionUntil Dawn: Rush of BloodNiohMLB The Show 18MLB The Show 17Shadow of the ColossusThe Last GuardianDetroit: Become HumanPlayStation VR WorldsUncharted: The Lost LegacyRatchet & Clank (2016)Gran Turismo SportHorizon: Zero DawnGod of War (2018)Marvel's Spider-ManUncharted 4: A Thief's End,Owlchemy LabsSupermassive Games Ltd.Rebellion DevelopmentsSurviosCCPGuerrilla CambridgeSIE London StudioMonstars Inc.Supermassive Games Ltd.Evolution StudiosCrytekPUBG CorporationSIE Japan StudioFirst Contact Entertainment Inc.SIE Japan StudioClap HanzSupermassive Games Ltd.Wish StudioSIE Japan StudioClever Beans / EPOS Game StudiosSupermassive Games Ltd.Team NinjaSIE San Diego StudioSIE San Diego StudioBluepoint GamesSIE Japan StudioQuantic DreamSIE London StudioNaughty DogInsomniac GamesPolyphony DigitalGuerrilla GamesSIE Santa Monica StudioInsomniac GamesNaughty Dog,115440000.0,56940000.0,22090000.0,23570000.0,2280000.0,9070000.0,2017-04-172018-01-232016-10-132018-09-252016-10-132016-10-132017-10-242018-11-092018-03-062016-10-132016-11-082018-12-072017-01-202018-08-292017-09-052017-08-292017-10-242017-10-242018-10-022017-06-062016-10-132017-02-072018-03-272017-03-282018-02-062016-12-062018-05-252016-10-132017-08-222016-04-122017-10-172017-02-282018-04-202018-09-072016-05-10,2018-05-042018-09-242018-06-302018-08-242018-06-152018-11-272018-04-072018-12-192018-09-112018-09-252018-09-142018-11-182018-02-092018-09-262018-09-232018-09-232018-09-242018-04-072018-09-172018-09-242018-09-242020-08-052018-09-172018-09-172018-11-262018-04-042018-06-052018-04-062018-04-252018-01-132020-09-242022-05-262018-09-262018-09-23,96.3,17702.0,1562.0,"Action, SimulationAdventureShooter, ActionAction, Simulation, SportsActionActionPuzzleRacingAdventure, ActionActionActionAdventure, ActionFamilyAdventureRacingActionAction, RPGSportsSportsAction, PuzzleAdventure, ActionActionAdventure, ActionRacingActionAction","PC, PlayStation 4PlayStation 4PC, PlayStation 4PC, PlayStation 4PC, PlayStation 4PlayStation 4PC, PlayStation 4PlayStation 4PlayStation 4PC, PlayStation 4PlayStation 4PlayStation 4PlayStation 4PlayStation 4, iOS, AndroidPlayStation 4PlayStation 4PlayStation 4PC, PlayStation 4PlayStation 4PlayStation 4PlayStation 4PC, PlayStation 4PlayStation 4PlayStation 5, PlayStation 4PlayStation 4PC, PlayStation 4PC, PlayStation 5, PlayStation 4"
PS3_Untold Legends: Dark KingdomPS3_DC Universe Online,PS3PS3,Untold Legends: Dark KingdomDC Universe Online,Sony Online EntertainmentWBIE,0.0,710000.0,490000.0,130000.0,20000.0,80000.0,2006-11-132011-01-11,0,2.97,177.0,130.0,"Action, RPGMassively Multiplayer, Adventure, Action, RPG","PlayStation 3PC, Xbox One, PlayStation 4, Nintendo Switch, PlayStation 3"
PS3_X-BladesPS3_Two Worlds II,PS3PS3,X-BladesTwo Worlds II,Gaijin EntertainmentReality Pump,0.0,610000.0,330000.0,130000.0,80000.0,50000.0,2009-02-102011-01-25,0,2.6,166.0,54.0,"Adventure, Action","PC, macOS, Linux, Xbox 360, PlayStation 3"
PS4_Fire Pro Wrestling World,PS4,Fire Pro Wrestling World,Spike Chunsoft,0.0,120000.0,60000.0,20000.0,30000.0,20000.0,2018-08-28,2018-09-12,4.12,24.0,79.0,"Simulation, Sports","PC, PlayStation 4"
