Game,Console,Name,Developer,Total Shipped,Total Sales,NA Sales,PAL Sales,Japan Sales,Other Sales,Release Date,Last Update,rating,ratings_count,metacritic,genres,platforms
PS3_Lucha Libre AAA: Heroes del RingPS3_Karaoke Revolution Presents American Idol Encore 2PS3_NeverDeadPS3_Hellboy: The Science of EvilPS3_DanceDanceRevolutionPS3_Saw II: Flesh & BloodPS3_No More Heroes: Heroes' ParadisePS3_Rock RevolutionPS3_Def Jam RapstarPS3_SAWPS3_Silent Hill: HomecomingPS3_Silent Hill: DownpourPS4_Pro Evolution Soccer 2019PS3_Castlevania: Lords of ShadowPS3_Pro Evolution Soccer 2008PS3_PES 2009: Pro Evolution SoccerPS3_Pro Evolution Soccer 2012PS3_Pro Evolution Soccer 2010PS3_Pro Evolution Soccer 2011,PS3PS3PS3PS3PS3PS3PS3PS3PS3PS3PS3PS3PS4PS3PS3PS3PS3PS3PS3,Lucha Libre AAA: Heroes del RingKaraoke Revolution Presents American Idol Encore 2NeverDeadHellboy: The Science of EvilDanceDanceRevolutionSaw II: Flesh & BloodNo More Heroes: Heroes' ParadiseRock RevolutionDef Jam RapstarSAWSilent Hill: HomecomingSilent Hill: DownpourPro Evolution Soccer 2019Castlevania: Lords of ShadowPro Evolution Soccer 2008PES 2009: Pro Evolution SoccerPro Evolution Soccer 2012Pro Evolution Soccer 2010Pro Evolution Soccer 2011,Immersion Software & GraphicsBlitz GamesRebellion DevelopmentsKrome StudiosKonamiZombie StudiosFeelPlusZoe Mode / HB Studios4mm Games / Terminal RealityZombie StudiosDouble Helix GamesKonamiKonamiMercury SteamKonamiKonamiKonamiKonamiKonami,0.0,15150000.0,3410000.0,7190000.0,2610000.0,1940000.0,2010-10-122008-11-182012-01-312008-06-242010-11-162010-10-192011-08-162008-10-142010-10-052009-10-062008-09-302012-03-132018-08-282010-10-052008-03-122008-11-112011-09-272009-11-032010-10-05,2018-09-26,35.5,1015.0,230.0,"Shooter, Adventure, ActionAdventure, ActionArcadeAdventure, ActionArcadeAdventure, ActionSimulation, SportsAdventure, ActionSportsSportsSportsSports","Xbox 360, PlayStation 3Xbox 360, PlayStation 3, PSPXbox 360, PlayStation 3, WiiXbox 360, PlayStation 3Xbox 360, PlayStation 3, WiiXbox 360, PlayStation 3PC, Xbox One, PlayStation 4PC, Xbox One, Xbox 360, PlayStation 3PC, Nintendo DS, Xbox 360, PlayStation 3, PlayStation 2, PSP, WiiPC, Xbox 360, PlayStation 3, PlayStation 2, PSPPC, Xbox 360, PlayStation 3, PlayStation 2, WiiPC, Nintendo 3DS, Xbox 360, PlayStation 3, PlayStation 2"
PS3_Castlevania: Lords of Shadow 2PS4_Metal Gear SurvivePS3_Birds of SteelPS3_Pro Evolution Soccer 2017PS4_Metal Gear Solid V: The Definitive ExperiencePS3_Silent Hill HD CollectionPS3_Zone of the Enders HD CollectionPS3_Metal Gear Solid: The Legacy CollectionPS3_Pro Evolution Soccer 2016PS3_Pro Evolution Soccer 2015PS3_Metal Gear Solid V: Ground ZeroesPS4_Pro Evolution Soccer 2017PS4_Pro Evolution Soccer 2018PS4_Pro Evolution Soccer 2015PS4_Pro Evolution Soccer 2016PS3_Pro Evolution Soccer 2014PS4_Metal Gear Solid V: Ground ZeroesPS3_Metal Gear Rising: RevengeancePS3_Pro Evolution Soccer 2013PS3_Metal Gear Solid HD CollectionPS4_Metal Gear Solid V: The Phantom Pain,PS3PS4PS3PS3PS4PS3PS3PS3PS3PS3PS3PS4PS4PS4PS4PS3PS4PS3PS3PS3PS4,Castlevania: Lords of Shadow 2Metal Gear SurviveBirds of SteelPro Evolution Soccer 2017Metal Gear Solid V: The Definitive ExperienceSilent Hill HD CollectionZone of the Enders HD CollectionMetal Gear Solid: The Legacy CollectionPro Evolution Soccer 2016Pro Evolution Soccer 2015Metal Gear Solid V: Ground ZeroesPro Evolution Soccer 2017Pro Evolution Soccer 2018Pro Evolution Soccer 2015Pro Evolution Soccer 2016Pro Evolution Soccer 2014Metal Gear Solid V: Ground ZeroesMetal Gear Rising: RevengeancePro Evolution Soccer 2013Metal Gear Solid HD CollectionMetal Gear Solid V: The Phantom Pain,Mercury SteamKonami Digital EntertainmentGaijin GamesPES ProductionsKojima ProductionsKonamiKojima ProductionsKonamiPES ProductionsPES ProductionsKojima ProductionsPES ProductionsKonami Digital EntertainmentPES ProductionsPES ProductionsKonamiKojima ProductionsPlatinumGamesKonamiBluepoint GamesKojima Productions,0.0,17030000.0,4670000.0,6470000.0,3760000.0,2120000.0,2014-02-252018-02-202012-03-132016-09-132016-10-112012-03-202012-10-302013-07-092015-09-152014-11-112014-03-182016-09-132017-09-122014-11-112015-09-152013-09-242014-03-182013-02-192012-09-252011-11-082015-09-01,2018-02-252018-05-292018-04-142018-04-242018-04-142018-04-142018-03-222018-05-04,67.04,8708.0,1094.0,"Adventure, ActionStrategy, Shooter, Adventure, ActionRacing, Arcade, Action, SimulationSimulation, SportsActionShooter, ActionAdventure, ActionSportsSportsShooter, ActionSimulation, SportsSportsSportsSportsSportsShooter, ActionActionSportsShooter, Action","PC, Xbox One, Xbox 360, PlayStation 3PC, Xbox One, PlayStation 4Xbox 360, PlayStation 3PC, Xbox One, PlayStation 4, Xbox 360, PlayStation 3PC, Xbox One, PlayStation 4PlayStation 3PlayStation 3PC, PlayStation 4, Xbox 360, PlayStation 3PC, Xbox One, PlayStation 4, Xbox 360, PlayStation 3PC, Xbox One, PlayStation 4, Xbox 360, PlayStation 3PC, Xbox One, PlayStation 4, Xbox 360, PlayStation 3PC, Xbox One, PlayStation 4, Xbox 360, PlayStation 3PC, Xbox One, PlayStation 4, Xbox 360, PlayStation 3PC, PlayStation 4, Xbox 360, PlayStation 3PC, Xbox 360, PlayStation 3, PlayStation 2, PSPPC, Xbox One, PlayStation 4, Xbox 360, PlayStation 3PC, Xbox One, Android, Xbox 360, PlayStation 3PC, Xbox 360, PlayStation 3, PlayStation 2, WiiPC, Xbox One, PlayStation 4, Xbox 360, PlayStation 3"
PS3_Adventure Time: Finn & Jake InvestigationsPS4_Adventure Time: Finn & Jake Investigations,PS3PS4,Adventure Time: Finn & Jake InvestigationsAdventure Time: Finn & Jake Investigations,Vicious CycleVicious Cycle,0.0,260000.0,110000.0,110000.0,0.0,40000.0,2015-10-202015-10-20,2018-03-17,0.0,0.0,0.0,0,0
PS3_FracturePS3_Star Wars The Clone Wars: Republic HeroesPS3_LEGO Indiana Jones 2: The Adventure ContinuesPS3_LEGO Indiana Jones: The Original AdventuresPS3_LEGO Star Wars III: The Clone WarsPS3_Star Wars: The Force Unleashed IIPS3_Star Wars: The Force UnleashedPS3_LEGO Star Wars: The Complete Saga,PS3PS3PS3PS3PS3PS3PS3PS3,FractureStar Wars The Clone Wars: Republic HeroesLEGO Indiana Jones 2: The Adventure ContinuesLEGO Indiana Jones: The Original AdventuresLEGO Star Wars III: The Clone WarsStar Wars: The Force Unleashed IIStar Wars: The Force UnleashedLEGO Star Wars: The Complete Saga,Day 1 StudiosKrome StudiosTraveller's TalesTraveller's TalesTraveller's TalesLucasArtsLucasArtsTraveller's Tales,0.0,9750000.0,4560000.0,3710000.0,0.0,1500000.0,2008-10-072009-10-062009-11-172008-06-032011-03-222010-10-262008-09-162007-11-06,0,20.740000000000002,1524.0,380.0,"Shooter, ActionAdventure, ActionFamily, Adventure, ActionFamily, Platformer, Adventure, ActionAdventure, ActionAdventure, Action","Xbox 360, PlayStation 3PC, Nintendo DS, Xbox 360, PlayStation 3, PlayStation 2, PSP, WiiPC, Xbox One, Nintendo DS, macOS, Xbox 360, PlayStation 3, WiiPC, Xbox One, Nintendo DS, Xbox 360, PlayStation 3, PlayStation 2, PSP, WiiPC, Xbox One, Nintendo DS, Xbox 360, PlayStation 3, WiiNintendo Switch, iOS, Nintendo DS, Xbox 360, PlayStation 3, PlayStation 2, PSP, Wii"
PS3_Rock Band Track Pack: Classic RockPS3_Rock Band: Metal Track PackPS3_Rock Band Track Pack Volume 2PS3_Rock Band Country Track PackPS3_AC/DC LIVE: Rock Band Track PackPS3_Green Day: Rock BandPS3_Rock Band 3PS3_The Beatles: Rock BandPS3_Rock Band 2PS3_Rock Band,PS3PS3PS3PS3PS3PS3PS3PS3PS3PS3,Rock Band Track Pack: Classic RockRock Band: Metal Track PackRock Band Track Pack Volume 2Rock Band Country Track PackAC/DC LIVE: Rock Band Track PackGreen Day: Rock BandRock Band 3The Beatles: Rock BandRock Band 2Rock Band,Harmonix Music SystemsHarmonix Music SystemsHarmonix Music SystemsHarmonix Music SystemsHarmonix Music SystemsHarmonix Music SystemsHarmonix Music SystemsHarmonix Music SystemsHarmonix Music SystemsHarmonix Music Systems,0.0,6010000.0,4120000.0,1150000.0,0.0,730000.0,2009-05-192009-09-222008-11-172009-07-212008-11-162010-06-082010-10-262009-09-092008-10-192007-11-20,0,20.79,584.0,168.0,ArcadeArcadeArcadeArcadeArcade,"Xbox 360, PlayStation 3, WiiNintendo DS, Xbox 360, PlayStation 3, WiiXbox 360, PlayStation 3, WiiXbox 360, PlayStation 3, PlayStation 2, WiiXbox 360, PlayStation 3, PlayStation 2, Wii"
PS3_Zumba Fitness,PS3,Zumba Fitness,"Pipeworks Software, Inc.",0.0,570000.0,280000.0,210000.0,0.0,70000.0,2010-11-18,0,0.0,2.0,0.0,"Arcade, Sports","Xbox 360, PlayStation 3, Wii"
PS3_Heavy Fire: Afghanistan,PS3,Heavy Fire: Afghanistan,Teyon Entertainment,0.0,190000.0,170000.0,0.0,0.0,30000.0,2011-11-18,0,3.13,15.0,0.0,"Shooter, Action","PC, PlayStation 3, Wii"
PS4_Rugby 15PS4_The Golf ClubPS4_Golf Club 2PS4_Conan Exiles,PS4PS4PS4PS4,Rugby 15The Golf ClubGolf Club 2Conan Exiles,HB StudiosHB StudiosHB StudiosFuncom Oslo A/S,0.0,600000.0,240000.0,190000.0,90000.0,80000.0,2015-02-242015-04-282017-06-272018-05-08,2018-09-172018-11-102018-07-032018-09-26,6.4399999999999995,476.0,137.0,"SportsSimulation, SportsMassively Multiplayer, Adventure, Action","PC, Xbox One, PlayStation 4, PlayStation 3, PS VitaPC, Xbox One, PlayStation 4PC, Xbox One, PlayStation 4"
PS3_NBA Ballers: Chosen OnePS3_Blitz: The League IIPS3_StrangleholdPS3_TNA iMPACT!PS3_Unreal Tournament IIIPS3_Mortal Kombat vs DC Universe,PS3PS3PS3PS3PS3PS3,NBA Ballers: Chosen OneBlitz: The League IIStrangleholdTNA iMPACT!Unreal Tournament IIIMortal Kombat vs DC Universe,Midway GamesMidway GamesMidway GamesMidway Studios Los AngelesEpic GamesMidway Amusement Games,0.0,3720000.0,2550000.0,710000.0,0.0,480000.0,2008-04-212008-10-132007-10-292008-09-092007-12-112008-11-16,0,6.58,178.0,77.0,"Shooter, ActionSports","PC, Xbox 360, PlayStation 3Xbox 360, PlayStation 3, Wii"
PS4_MXGP 3: The Official Motocross Videogame,PS4,MXGP 3: The Official Motocross Videogame,Milestone,0.0,170000.0,60000.0,80000.0,0.0,30000.0,2017-06-20,2018-06-25,0.0,0.0,0.0,0,0
PS4_MXGP 2PS4_Ride 2,PS4PS4,MXGP 2Ride 2,Milestone S.r.l.Milestone S.r.l.,0.0,300000.0,120000.0,120000.0,10000.0,50000.0,2016-06-212017-02-14,2018-06-192018-06-25,3.62,21.0,67.0,"Racing, Simulation, Sports","PC, Xbox One, PlayStation 4"
PS4_Monster Energy Supercross - The Official VideogamePS4_Ride,PS4PS4,Monster Energy Supercross - The Official VideogameRide,Milestone S.r.l.Milestone S.r.l.,0.0,350000.0,120000.0,140000.0,30000.0,50000.0,2018-02-132015-06-23,2018-02-272018-04-24,5.029999999999999,124.0,136.0,"Racing, SportsRacing, Simulation, Sports","PC, Xbox One, PlayStation 4, Nintendo SwitchPC, Xbox One, PlayStation 4, Xbox 360, PlayStation 3"
PS4_Minecraft: Story ModePS3_Minecraft: Story Mode,PS4PS3,Minecraft: Story ModeMinecraft: Story Mode,Telltale GamesTelltale Games,0.0,1760000.0,630000.0,850000.0,0.0,290000.0,2015-10-272015-10-27,2018-01-13,6.8,648.0,0.0,"Adventure, ActionAdventure, Action","PC, PlayStation 4, Xbox One, Nintendo Switch, iOS, Android, macOS, Xbox 360, PlayStation 3, Wii UPC, PlayStation 4, Xbox One, Nintendo Switch, iOS, Android, macOS, Xbox 360, PlayStation 3, Wii U"
PS4_The Witch and the Hundred KnightPS4_Danganronpa 1-2 ReloadPS4_Grand KingdomPS4_Psycho-Pass: Mandatory HappinessPS3_Tears to Tiara II: Heir of the OverlordPS3_Mugen SoulsPS3_Time and EternityPS3_Trinity UniversePS3_Fairy Fencer FPS4_Ys VIII: Lacrimosa of DanaPS3_The Witch and the Hundred KnightPS3_Disgaea D2PS3_Cross EdgePS3_Ar tonelico Qoga: Knell of Ar CielPS3_Atelier Meruru: Alchemist of Arland 3PS4_Danganronpa V3: Killing HarmonyPS4_Onechanbara Z2: ChaosPS4_Disgaea 5: Alliance of VengeancePS3_Atelier Totori: The Adventurer of ArlandPS3_Hyperdimension NeptuniaPS3_Atelier Rorona: Alchemist of ArlandPS3_Bleach: Soul ResurreccionPS3_Disgaea 3: Absence of JusticePS3_Disgaea 4: A Promise Unforgotten,PS4PS4PS4PS4PS3PS3PS3PS3PS3PS4PS3PS3PS3PS3PS3PS4PS4PS4PS3PS3PS3PS3PS3PS3,The Witch and the Hundred KnightDanganronpa 1-2 ReloadGrand KingdomPsycho-Pass: Mandatory HappinessTears to Tiara II: Heir of the OverlordMugen SoulsTime and EternityTrinity UniverseFairy Fencer FYs VIII: Lacrimosa of DanaThe Witch and the Hundred KnightDisgaea D2Cross EdgeAr tonelico Qoga: Knell of Ar CielAtelier Meruru: Alchemist of Arland 3Danganronpa V3: Killing HarmonyOnechanbara Z2: ChaosDisgaea 5: Alliance of VengeanceAtelier Totori: The Adventurer of ArlandHyperdimension NeptuniaAtelier Rorona: Alchemist of ArlandBleach: Soul ResurreccionDisgaea 3: Absence of JusticeDisgaea 4: A Promise Unforgotten,Nippon Ichi SoftwareSpike ChunsoftMonochrome Corporation5pb. Inc.StingCompile Heartimageepoch Inc.Nippon Ichi Software / GustCompile HeartFalcomNippon Ichi SoftwareUnknownCompile HeartGustGustSpike ChunsoftTamsoftNippon Ichi SoftwareGustCompile HeartGustEightingNippon Ichi SoftwareNippon Ichi Software,170000.0,6600000.0,2960000.0,960000.0,1980000.0,680000.0,2016-03-012017-03-142016-06-282016-09-132014-10-142012-09-302013-07-162010-06-292014-09-162017-09-122014-03-252013-10-082009-05-262011-03-152012-05-222017-09-262015-07-212015-10-062011-09-272011-02-152014-06-242011-08-032008-08-262011-09-06,2018-07-042018-01-102018-07-032018-07-032018-01-102018-01-222018-05-30,46.61,627.0,758.0,"Action, RPGStrategy, RPGAdventureStrategyStrategy, Adventure, RPGRPGRPGRPGAction, RPGAction, RPGRPGAdventure, RPGPuzzleActionRPGRPGRPGActionStrategy, RPGStrategy, RPG","PlayStation 4, PlayStation 3PlayStation 4, PS VitaPC, Xbox One, PlayStation 4, PS VitaPlayStation 3PC, PlayStation 3PlayStation 3PlayStation 3PC, PlayStation 3PC, PlayStation 5, PlayStation 4, Nintendo Switch, iOS, Android, PS VitaPlayStation 4, PlayStation 3PlayStation 3PlayStation 3PC, PlayStation 4, Nintendo Switch, PS VitaPC, PlayStation 4PC, PlayStation 4, Nintendo SwitchPlayStation 3PlayStation 3PlayStation 3PlayStation 3PlayStation 3"
PS3_Tekken Hybrid,PS3,Tekken Hybrid,Namco Bandai Games,0.0,360000.0,210000.0,70000.0,40000.0,40000.0,2011-11-22,0,0.0,3.0,0.0,Fighting,PlayStation 3
PS3_SplatterhousePS3_Afro SamuraiPS3_Mobile Suit Gundam: CrossfirePS3_Dead to Rights: RetributionPS3_Majin and the Forsaken KingdomPS3_Clash of the Titans: The VideogamePS3_Armored Core VPS3_Katamari ForeverPS3_Eternal SonataPS3_Dynasty Warriors GundamPS3_Dynasty Warriors: Gundam 2PS3_Time Crisis: Razing StormPS3_Enslaved: Odyssey to the WestPS3_Dragon Ball Z: Ultimate TenkaichiPS3_Ace Combat: Assault HorizonPS3_Dragon Ball: Raging BlastPS3_Dragon Ball: Raging Blast 2PS3_Time Crisis 4PS3_Tales of Graces fPS3_Naruto: Ultimate Ninja StormPS3_Ridge Racer 7PS3_Dark Souls,PS3PS3PS3PS3PS3PS3PS3PS3PS3PS3PS3PS3PS3PS3PS3PS3PS3PS3PS3PS3PS3PS3,SplatterhouseAfro SamuraiMobile Suit Gundam: CrossfireDead to Rights: RetributionMajin and the Forsaken KingdomClash of the Titans: The VideogameArmored Core VKatamari ForeverEternal SonataDynasty Warriors GundamDynasty Warriors: Gundam 2Time Crisis: Razing StormEnslaved: Odyssey to the WestDragon Ball Z: Ultimate TenkaichiAce Combat: Assault HorizonDragon Ball: Raging BlastDragon Ball: Raging Blast 2Time Crisis 4Tales of Graces fNaruto: Ultimate Ninja StormRidge Racer 7Dark Souls,BottleRocketNamco Bandai GamesNamco Bandai Games AmericaVolatile GamesGame RepublicGame RepublicFrom SoftwareBandai Namco GamesTri-CrescendoOmega ForceOmega ForceNex EntertainmentNinja TheorySpikeProject ACESSpikeSpikeBandai Namco GamesNamco Tales StudioCyberConnect2Namco BandaiFrom Software,0.0,14020000.0,5230000.0,4010000.0,3080000.0,1710000.0,2010-11-232009-01-272006-11-132010-04-272010-11-232010-07-272012-03-202009-09-222008-10-212007-08-282009-04-212010-10-192010-10-052011-10-252011-10-112009-11-102010-11-022007-11-202012-03-132008-11-042006-11-132011-10-04,0,53.39,1780.0,770.0,"Adventure, ActionSimulationShooter, ActionAdventure, Action, PuzzleAdventure, Action, SimulationArcadeRPGActionArcadeAdventure, ActionArcade, FightingShooter, Action, SimulationFightingFightingRPGAction, FightingRacing, ArcadeAction, RPG","Xbox 360, PlayStation 3PlayStation 3Xbox 360, PlayStation 3Xbox 360, PlayStation 3Xbox 360, PlayStation 3PlayStation 3Xbox 360, PlayStation 3PlayStation 3, PlayStation 2PlayStation 3PC, Xbox 360, PlayStation 3Xbox 360, PlayStation 3Xbox 360, PlayStation 3Xbox 360, PlayStation 3Xbox 360, PlayStation 3PlayStation 3PlayStation 3, WiiPC, Xbox One, PlayStation 4, Nintendo Switch, Xbox 360, PlayStation 3PlayStation 3PC, Xbox 360, PlayStation 3"
PS3_Pac-Man and the Ghostly Adventures 2PS3_MotoGP 14PS4_Valentino Rossi: The GamePS4_New Gundam BreakerPS4_Naruto Shippuden: Ultimate Ninja Storm LegacyPS4_Digimon Story: Cyber Sleuth - Hacker's MemoryPS3_Ridge Racer UnboundedPS4_Godzilla (2015)PS4_MotoGP 14PS4_Digimon World: Next OrderPS4_.hack//G.U. Last RecodePS3_Star Trek: The GamePS4_Gundam VersusPS4_Sword Art Online: Fatal BulletPS3_One Piece Unlimited World: RedPS4_J Stars Victory Vs.PS3_Dragon Ball Z: Battle of ZPS3_Project Versus JPS4_Sword Art Online: Lost SongPS4_Little NightmaresPS4_Sword Art Online: Hollow RealizationPS4_Tales of ZestiriaPS3_Naruto Shippuden: Ultimate Ninja Storm RevolutionPS3_Tales of Symphonia ChroniclesPS4_Project CARS 2PS4_Lords of the FallenPS4_Tales of BerseriaPS4_One Piece: Burning BloodPS4_Dark Souls II: Scholar of the First SinPS3_Naruto Shippuden: Ultimate Ninja Storm GenerationsPS4_Ni no Kuni II: Revenant KingdomPS4_Dragon Ball: XenoversePS3_Dark Souls IIPS4_Dragon Ball FighterZPS4_Dragon Ball: Xenoverse 2PS4_Naruto Shippuden: Ultimate Ninja Storm 4PS4_Tekken 7PS4_Dark Souls III,PS3PS3PS4PS4PS4PS4PS3PS4PS4PS4PS4PS3PS4PS4PS3PS4PS3PS3PS4PS4PS4PS4PS3PS3PS4PS4PS4PS4PS4PS3PS4PS4PS3PS4PS4PS4PS4PS4,Pac-Man and the Ghostly Adventures 2MotoGP 14Valentino Rossi: The GameNew Gundam BreakerNaruto Shippuden: Ultimate Ninja Storm LegacyDigimon Story: Cyber Sleuth - Hacker's MemoryRidge Racer UnboundedGodzilla (2015)MotoGP 14Digimon World: Next Order.hack//G.U. Last RecodeStar Trek: The GameGundam VersusSword Art Online: Fatal BulletOne Piece Unlimited World: RedJ Stars Victory Vs.Dragon Ball Z: Battle of ZProject Versus JSword Art Online: Lost SongLittle NightmaresSword Art Online: Hollow RealizationTales of ZestiriaNaruto Shippuden: Ultimate Ninja Storm RevolutionTales of Symphonia ChroniclesProject CARS 2Lords of the FallenTales of BerseriaOne Piece: Burning BloodDark Souls II: Scholar of the First SinNaruto Shippuden: Ultimate Ninja Storm GenerationsNi no Kuni II: Revenant KingdomDragon Ball: XenoverseDark Souls IIDragon Ball FighterZDragon Ball: Xenoverse 2Naruto Shippuden: Ultimate Ninja Storm 4Tekken 7Dark Souls III,Monkey Bar GamesMilestone S.r.l.Milestone S.r.l.Bandai Namco GamesCyberConnect2Media.VisionBugbear EntertainmentNatsumeMilestone S.r.l.Bandai Namco GamesCyberConnect2Digital ExtremesNamco Bandai GamesDimps CorporationGanbarionNamco Bandai GamesArtDinkUnknownNamco Bandai GamesTarsier StudiosAquriaNamco Bandai GamesCyberConnect2NamcoSlightly Mad StudiosDECK13 InteractiveNamco Bandai GamesSpike ChunsoftFrom SoftwareCyberConnect2Level 5Dimps CorporationFrom SoftwareArc System WorksDimps CorporationCyberConnect2Namco Bandai GamesFrom Software,28770000.0,22360000.0,8280000.0,7370000.0,3570000.0,3150000.0,2014-10-142014-11-042016-07-262018-06-222017-08-252018-01-192012-03-272015-07-142014-11-042017-01-312017-11-032013-04-232017-09-292018-02-232014-07-082015-06-302014-01-282015-06-302015-11-172017-04-282016-11-082015-10-202014-10-012014-02-252017-09-222014-10-282017-01-242016-05-312015-04-072012-03-132018-03-232015-02-242015-04-072018-01-262016-10-252016-02-092017-06-022016-04-12,2018-06-252018-04-212018-01-072018-04-202018-11-032018-04-212018-06-102018-01-122018-02-232019-02-202019-03-222018-05-102018-05-232018-04-232018-02-282018-09-112018-04-022018-03-032018-09-222018-01-152018-04-23,87.63,9981.0,1627.0,"Platformer, Adventure, ActionRacing, Simulation, SportsActionRacing, ActionRacing, Simulation, SportsRPGRPGAction, FightingShooter, Action, RPGAction, RPG, FightingAction, RPGPlatformer, Adventure, ActionRPGRPGAdventure, Action, FightingRPGRacing, Simulation, SportsAction, RPGAction, RPGArcade, Action, FightingAction, RPGArcade, FightingAdventure, RPGAction, RPGAction, FightingAction, FightingAction, Fighting, SportsAction, RPG","PC, Nintendo 3DS, Xbox 360, PlayStation 3, Wii UPC, PlayStation 4, Xbox 360, PlayStation 3, PS VitaPC, PlayStation 4PC, Xbox 360, PlayStation 3PC, PlayStation 4, Xbox 360, PlayStation 3, PS VitaPC, PlayStation 4, Nintendo Switch, PS VitaPC, PlayStation 4, Nintendo SwitchPlayStation 4PC, Xbox One, PlayStation 4Xbox 360, PlayStation 3, PS VitaPC, PlayStation 4, PlayStation 3, PS VitaPC, Xbox One, PlayStation 4, Nintendo Switch, iOSPC, PlayStation 4, PS VitaPC, PlayStation 4, PlayStation 3PC, Xbox 360, PlayStation 3PlayStation 3PC, Xbox One, PlayStation 4PC, PlayStation 5, Xbox One, PlayStation 4, Xbox Series S/XPC, PlayStation 4, PlayStation 3PC, Xbox One, PlayStation 4, PS VitaPC, Xbox One, PlayStation 4Xbox 360, PlayStation 3PC, Xbox One, PlayStation 4, Xbox Series S/X, Nintendo SwitchPC, Xbox One, PlayStation 4, Xbox 360, PlayStation 3PC, Xbox One, PlayStation 4, Nintendo SwitchPC, Xbox One, PlayStation 4PC, Xbox One, PlayStation 4PC, Xbox One, PlayStation 4"
PS3_AfrikaPS3_Rune Factory: Tides of Destiny,PS3PS3,AfrikaRune Factory: Tides of Destiny,Rhino StudiosNeverland Company,0.0,450000.0,260000.0,0.0,150000.0,30000.0,2009-10-062011-10-11,0,3.92,17.0,0.0,SportsRPG,"PlayStation 3PlayStation 3, Wii"
PS4_Legend of Kay AnniversaryPS4_Darksiders II: Deathinitive Edition,PS4PS4,Legend of Kay AnniversaryDarksiders II: Deathinitive Edition,Neon StudiosGunfire Games,0.0,390000.0,130000.0,190000.0,0.0,60000.0,2015-05-292015-10-30,2018-09-112018-10-02,3.26,39.0,64.0,"Adventure, Action, RPG, Fighting","PC, PlayStation 4, Nintendo Switch, macOS, Xbox 360, PlayStation 3, Wii U"
PS3_John Daly's ProStroke Golf,PS3,John Daly's ProStroke Golf,Gusto Games,0.0,110000.0,90000.0,20000.0,0.0,10000.0,2010-10-05,0,0.0,1.0,0.0,Sports,"PC, PlayStation 3"
PS4_Pillars of Eternity,PS4,Pillars of Eternity,Obsidian Entertainment,0.0,160000.0,110000.0,20000.0,0.0,30000.0,2017-08-29,2018-04-15,3.96,716.0,89.0,RPG,"PC, Xbox One, PlayStation 4, macOS, Linux"
PS3_Rango: The Video Game,PS3,Rango: The Video Game,Behaviour Studios,0.0,190000.0,70000.0,90000.0,0.0,30000.0,2011-03-01,0,0.0,0.0,0.0,Arcade,PlayStation 3
PS3_Fairytale Fights,PS3,Fairytale Fights,Playlogic Game Factory,0.0,170000.0,110000.0,40000.0,0.0,20000.0,2009-10-27,0,2.83,6.0,0.0,Arcade,PlayStation 3
PS3_Bejeweled 3PS3_Plants vs. Zombies,PS3PS3,Bejeweled 3Plants vs. Zombies,PopCap GamesPopCap,0.0,360000.0,310000.0,0.0,0.0,50000.0,2011-11-152011-11-15,0,7.73,996.0,168.0,"Casual, Strategy, Family, PuzzleStrategy, Arcade, Puzzle","PC, Nintendo DS, macOS, Xbox 360, PlayStation 3PC, Xbox One, iOS, Android, Nintendo DS, Xbox 360, PlayStation 3, PS Vita"
PS4_Zombie Army TrilogyPS4_Sniper Elite 4,PS4PS4,Zombie Army TrilogySniper Elite 4,Rebellion DevelopmentsRebellion Developments,0.0,770000.0,270000.0,380000.0,0.0,120000.0,2015-03-062017-02-14,2018-05-302018-05-29,6.91,937.0,150.0,"Shooter, ActionShooter, Adventure, Action","PC, Xbox One, PlayStation 4, Nintendo SwitchPC, PlayStation 5, Xbox One, PlayStation 4, Xbox Series S/X, Nintendo Switch"
PS3_Guitar Hero III: Legends of Rock,PS3,Guitar Hero III: Legends of Rock,Neversoft,0.0,2250000.0,1400000.0,530000.0,20000.0,300000.0,2007-10-28,0,4.4,237.0,82.0,Arcade,"PC, macOS, Xbox 360, PlayStation 3, PlayStation 2, Wii"
PS3_Deadly Premonition: The Director's Cut,PS3,Deadly Premonition: The Director's Cut,Access Games,0.0,160000.0,80000.0,50000.0,0.0,30000.0,2013-04-30,0,3.84,203.0,67.0,"Adventure, Action","PC, PlayStation 3"
PS4_L.A. NoirePS3_Red Dead Redemption: Undead NightmarePS3_Max Payne 3PS3_Grand Theft Auto: Episodes from Liberty CityPS3_Midnight Club: Los AngelesPS3_L.A. NoirePS3_Red Dead RedemptionPS3_Grand Theft Auto IVPS4_Red Dead Redemption 2PS4_Grand Theft Auto VPS3_Grand Theft Auto V,PS4PS3PS3PS3PS3PS3PS3PS3PS4PS4PS3,L.A. NoireRed Dead Redemption: Undead NightmareMax Payne 3Grand Theft Auto: Episodes from Liberty CityMidnight Club: Los AngelesL.A. NoireRed Dead RedemptionGrand Theft Auto IVRed Dead Redemption 2Grand Theft Auto VGrand Theft Auto V,Team BondiRockstar San DiegoRockstar VancouverRockstar NorthRockstar San DiegoTeam BondiRockstar San DiegoRockstar NorthRockstar GamesRockstar NorthRockstar North,0.0,82230000.0,30040000.0,36620000.0,2830000.0,12740000.0,2017-11-142010-11-232012-05-152010-04-132008-10-202011-11-152011-10-112008-04-292018-10-262014-11-182013-09-17,2018-06-192018-11-022018-01-03,46.74,31983.0,892.0,"Adventure, ActionShooter, Adventure, ActionShooter, ActionActionRacing, ArcadeAdventure, ActionShooter, ActionActionActionActionAction","PC, Xbox One, PlayStation 4, Nintendo Switch, Xbox 360, PlayStation 3Xbox 360, PlayStation 3PC, macOS, Xbox 360, PlayStation 3PC, Xbox 360, PlayStation 3Xbox 360, PlayStation 3, PSPPC, Xbox One, PlayStation 4, Nintendo Switch, Xbox 360, PlayStation 3PC, Xbox One, PlayStation 4, Nintendo Switch, Xbox 360, PlayStation 3PC, Xbox One, Xbox 360, PlayStation 3PC, Xbox One, PlayStation 4PC, PlayStation 5, Xbox One, PlayStation 4, Xbox Series S/X, Xbox 360, PlayStation 3PC, PlayStation 5, Xbox One, PlayStation 4, Xbox Series S/X, Xbox 360, PlayStation 3"
PS4_Bendy and the Ink Machine,PS4,Bendy and the Ink Machine,TheMeatly Games,0.0,180000.0,150000.0,0.0,0.0,30000.0,2018-11-20,2018-12-19,3.48,144.0,68.0,"Indie, Adventure, Action, Puzzle","PC, Xbox One, PlayStation 4, Nintendo Switch, iOS, Android, macOS, Linux, PS Vita"
