Game,Console,Name,Developer,Total Shipped,Total Sales,NA Sales,PAL Sales,Japan Sales,Other Sales,Release Date,Last Update,rating,ratings_count,metacritic,genres,platforms
PS3_Fantastic Four: Rise of the Silver SurferPS3_The Bureau: XCOM DeclassifiedPS4_XCOM 2PS3_The Darkness IIPS3_WWE 2K17PS4_BattlebornPS3_Spec Ops: The LinePS3_XCOM: Enemy UnknownPS3_Borderlands: The Pre-SequelPS3_The DarknessPS3_Duke Nukem ForeverPS3_Sid Meier's Civilization RevolutionPS4_BioShock: The CollectionPS4_EvolvePS4_WWE 2K17PS4_Borderlands: The Handsome CollectionPS3_BioShockPS3_Mafia IIPS3_BioShock 2PS3_BioShock InfinitePS3_BorderlandsPS3_Borderlands 2PS4_Mafia III,PS3PS3PS4PS3PS3PS4PS3PS3PS3PS3PS3PS3PS4PS4PS4PS4PS3PS3PS3PS3PS3PS3PS4,Fantastic Four: Rise of the Silver SurferThe Bureau: XCOM DeclassifiedXCOM 2The Darkness IIWWE 2K17BattlebornSpec Ops: The LineXCOM: Enemy UnknownBorderlands: The Pre-SequelThe DarknessDuke Nukem ForeverSid Meier's Civilization RevolutionBioShock: The CollectionEvolveWWE 2K17Borderlands: The Handsome CollectionBioShockMafia IIBioShock 2BioShock InfiniteBorderlandsBorderlands 2Mafia III,"Visual Concepts2K MarinFiraxis GamesDigital ExtremesYuke'sGearbox SoftwareYager DevelopmentFiraxis GamesUnknownStarbreezeGearbox SoftwareFiraxis GamesBlind Squirrel Digital, IncTurtle Rock StudiosYuke'sGearbox Software2K Boston / 2K Australia / 2K MarinIllusion Softworks2K MarinIrrational GamesGearbox SoftwareGearbox SoftwareHangar 13",0.0,23820000.0,10240000.0,9390000.0,490000.0,3660000.0,2007-06-152013-08-202016-09-272012-02-072016-10-112016-05-032012-06-262012-10-092014-10-142007-05-252011-06-142008-07-082016-09-132015-02-102016-10-112015-03-242008-10-212010-08-242010-02-092013-03-262009-10-202012-09-182016-10-07,2018-05-292018-04-262018-05-102018-04-052018-04-02,81.64,28026.0,1673.0,"ArcadeShooter, ActionStrategy, RPGActionFighting, Simulation, SportsShooter, ActionShooter, ActionStrategyShooter, Action, RPGShooter, ActionShooter, ActionStrategy, SimulationShooter, ActionShooter, ActionFighting, Simulation, SportsAdventure, ActionShooter, ActionShooter, ActionShooter, ActionShooter, ActionShooter, Action, RPGShooter, Action, RPGAdventure, Action","Nintendo DS, PlayStation 3, PlayStation 2, WiiPC, macOS, Xbox 360, PlayStation 3PC, PlayStation 4, Nintendo Switch, macOS, LinuxPC, Xbox One, macOS, Xbox 360, PlayStation 3PC, Xbox One, PlayStation 4, Xbox 360, PlayStation 3PC, Xbox One, PlayStation 4PC, Xbox One, Xbox 360, PlayStation 3PC, iOS, Android, macOS, Xbox 360, PlayStation 3PC, Android, macOS, Linux, Xbox 360, PlayStation 3Xbox One, Xbox 360, PlayStation 3PC, Xbox One, macOS, Xbox 360, PlayStation 3Xbox One, iOS, Android, Nintendo DS, Xbox 360, PlayStation 3PC, Xbox One, PlayStation 4, Nintendo SwitchPC, Xbox One, PlayStation 4PC, Xbox One, PlayStation 4, Xbox 360, PlayStation 3PC, Xbox One, PlayStation 4, Nintendo SwitchPC, macOS, Xbox 360, PlayStation 3PC, Xbox One, Xbox 360, PlayStation 3PC, Xbox One, PlayStation 4, Nintendo Switch, macOS, Xbox 360, PlayStation 3PC, Xbox One, PlayStation 4, Nintendo Switch, Linux, Xbox 360, PlayStation 3PC, Xbox 360, PlayStation 3PC, Android, macOS, Linux, Xbox 360, PlayStation 3, PS VitaPC, Xbox One, PlayStation 4, macOS"
PS3_NHL 2K9PS3_NHL 2K7PS3_The BIGS 2PS3_College Hoops 2K8PS3_NHL 2K10PS3_All-Pro Football 2K8PS3_The BIGSPS3_Major League Baseball 2K13PS3_Major League Baseball 2K9PS3_College Hoops 2K7PS3_Major League Baseball 2K10PS3_Major League Baseball 2K11PS3_Major League Baseball 2K7PS3_Major League Baseball 2K8PS3_NBA 2K17PS3_NBA 2K7PS3_NBA 2K8PS3_Top Spin 3PS3_NBA 2K9PS3_Top Spin 4PS3_NBA 2K16PS3_WWE 2K15PS3_NBA 2K10PS4_WWE 2K19PS4_WWE 2K15PS3_WWE 2K14PS4_WWE 2K18PS3_NBA 2K15PS4_NBA 2K14PS3_NBA 2K11PS3_NBA 2K12PS3_NBA 2K14PS4_NBA 2K15PS3_NBA 2K13PS4_NBA 2K19PS4_NBA 2K18PS4_NBA 2K17PS4_NBA 2K16,PS3PS3PS3PS3PS3PS3PS3PS3PS3PS3PS3PS3PS3PS3PS3PS3PS3PS3PS3PS3PS3PS3PS3PS4PS4PS3PS4PS3PS4PS3PS3PS3PS4PS3PS4PS4PS4PS4,NHL 2K9NHL 2K7The BIGS 2College Hoops 2K8NHL 2K10All-Pro Football 2K8The BIGSMajor League Baseball 2K13Major League Baseball 2K9College Hoops 2K7Major League Baseball 2K10Major League Baseball 2K11Major League Baseball 2K7Major League Baseball 2K8NBA 2K17NBA 2K7NBA 2K8Top Spin 3NBA 2K9Top Spin 4NBA 2K16WWE 2K15NBA 2K10WWE 2K19WWE 2K15WWE 2K14WWE 2K18NBA 2K15NBA 2K14NBA 2K11NBA 2K12NBA 2K14NBA 2K15NBA 2K13NBA 2K19NBA 2K18NBA 2K17NBA 2K16,"Visual Concepts2K SportsBlue Castle GamesVisual ConceptsVisual ConceptsVisual ConceptsBlue Castle GamesVisual Concepts, Ltd.Visual ConceptsVisual ConceptsVisual ConceptsVisual ConceptsKush GamesKush GamesVisual ConceptsVisual ConceptsVisual ConceptsPam DevelopmentVisual Concepts2K CzechVisual ConceptsVisual ConceptsVisual ConceptsVisual ConceptsVisual ConceptsYuke'sYuke'sVisual ConceptsVisual ConceptsVisual ConceptsVisual ConceptsVisual ConceptsVisual ConceptsVisual ConceptsVisual ConceptsVisual ConceptsVisual ConceptsVisual Concepts",0.0,40370000.0,25430000.0,8270000.0,440000.0,6200000.0,2008-09-082006-11-132009-07-072007-11-192009-09-152007-07-162007-06-252013-03-052009-03-032007-03-132010-03-022011-03-082007-02-262008-03-032016-09-162006-11-132007-10-022008-06-232008-10-072011-03-152015-09-292014-10-282009-10-062018-10-092014-11-182013-10-292017-10-172014-10-072013-11-152010-10-052011-10-042013-10-012014-10-072012-10-022018-09-112017-09-192016-09-162015-09-29,2018-06-222018-01-062018-01-052018-01-042018-09-262018-04-022018-03-282018-03-28,78.44,2474.0,1708.0,"SportsSportsSportsSportsSportsSportsAction, SportsSportsSportsSportsFighting, SportsSportsSimulation, SportsFighting, SportsArcade, Fighting, SportsSimulation, SportsSportsSportsSportsSportsSportsSportsSportsAction, Simulation, SportsAction, Simulation, SportsAction, SportsSports","Xbox 360, PlayStation 3, PlayStation 2, WiiXbox 360, PlayStation 3, PlayStation 2, WiiPC, Xbox 360, PlayStation 3, PlayStation 2, WiiPC, Nintendo DS, PlayStation 3, PlayStation 2, WiiPC, Nintendo DS, PlayStation 3, PlayStation 2, WiiXbox 360, Xbox, PlayStation 3, PlayStation 2, Game Boy AdvancePC, Xbox One, PlayStation 4, iOS, Xbox 360, PlayStation 3Nintendo DS, PlayStation 3, WiiXbox 360, PlayStation 3, WiiPC, Xbox One, PlayStation 4, Xbox 360, PlayStation 3PC, Xbox One, PlayStation 4, Xbox 360, PlayStation 3PC, PlayStation 3, PlayStation 2, WiiPC, Xbox One, PlayStation 4PC, Xbox One, PlayStation 4, Xbox 360, PlayStation 3Xbox 360, PlayStation 3PC, Xbox One, PlayStation 4, Nintendo SwitchPC, Xbox One, PlayStation 4, Xbox 360, PlayStation 3PC, Xbox One, PlayStation 4, Xbox 360, PlayStation 3PC, PlayStation 3, PlayStation 2, WiiPC, Xbox 360, PlayStation 3, PlayStation 2, WiiPC, Xbox One, PlayStation 4, Xbox 360, PlayStation 3PC, Xbox One, PlayStation 4, Xbox 360, PlayStation 3PC, Xbox 360, PlayStation 3, PS Vita, PSP, Wii U, WiiPC, Xbox One, PlayStation 4, Nintendo Switch, iOS, AndroidPC, Xbox One, PlayStation 4, Nintendo Switch, iOS, Android, Xbox 360PC, Xbox One, PlayStation 4, iOS, Xbox 360, PlayStation 3PC, Xbox One, PlayStation 4, Xbox 360, PlayStation 3"
PS4_Portal KnightsPS3_Supremacy MMAPS4_Brothers: A Tale of Two SonsPS3_BackbreakerPS4_Dead by DaylightPS3_Sniper Elite IIIPS4_Payday 2PS3_Naughty BearPS3_TerrariaPS3_Payday 2PS3_IL-2 Sturmovik: Birds of PreyPS4_Sniper Elite IIIPS3_Sniper Elite V2PS4_Rocket League,PS4PS3PS4PS3PS4PS3PS4PS3PS3PS3PS3PS4PS3PS4,Portal KnightsSupremacy MMABrothers: A Tale of Two SonsBackbreakerDead by DaylightSniper Elite IIIPayday 2Naughty BearTerrariaPayday 2IL-2 Sturmovik: Birds of PreySniper Elite IIISniper Elite V2Rocket League,Keen GamesKung Fu FactoryStarbreeze StudiosNaturalMotion GamesBehaviour Interactive Inc.Rebellion DevelopmentsOverkill SoftwareArtificial Mind and MovementEngine SoftwareOverkill SoftwareGaijin EntertainmentRebellion DevelopmentsRebellion DevelopmentsPsyonix Studios,0.0,7220000.0,2500000.0,3420000.0,200000.0,1100000.0,2017-05-232011-09-202015-08-122010-06-012017-06-202014-07-012015-06-162010-06-292013-07-302013-08-132009-09-082014-07-012012-05-022016-07-05,2018-07-032018-06-272019-02-132018-01-082018-09-222018-04-04,28.380000000000003,9145.0,514.0,"Adventure, Action, RPGArcade, FightingIndie, Adventure, ActionSportsActionArcade, Adventure, ActionPlatformer, Indie, ActionShooter, ActionRacing, Indie, Sports","PC, Xbox One, PlayStation 4, Nintendo Switch, iOS, AndroidXbox 360, PlayStation 3PC, PlayStation 4, Xbox One, Nintendo Switch, iOS, Android, Xbox 360, PlayStation 3Xbox 360, PlayStation 3PC, PlayStation 5, Xbox One, PlayStation 4, Nintendo SwitchXbox 360, PlayStation 3PC, Xbox One, PlayStation 4, Nintendo Switch, iOS, Android, Nintendo 3DS, macOS, Linux, Xbox 360, PlayStation 3, PS Vita, Wii UPC, Xbox 360, PlayStation 3, Wii UPC, Xbox One, PlayStation 4, Nintendo Switch, macOS, Linux"
PS4_NASCAR Heat 3PS4_NASCAR Heat 2,PS4PS4,NASCAR Heat 3NASCAR Heat 2,Monster GamesMonster Games,0.0,260000.0,210000.0,0.0,0.0,40000.0,2018-09-072017-09-12,2018-07-092018-06-25,3.12,12.0,128.0,RacingRacing,"PC, Xbox One, PlayStation 4PC, Xbox One, PlayStation 4"
PS3_Cabela's Adventure CampPS3_Call of Duty: Modern Warfare TrilogyPS3_Transformers: DevastationPS3_Transformer: Rise of the Dark SparkPS3_Wipeout 2PS3_DreamWorks Super Star KartzPS4_Teenage Mutant Ninja Turtles: Mutants in ManhattanPS3_Cabela's North American AdventuresPS3_Cabela's Dangerous Hunts 2009PS3_Soldier of Fortune: PaybackPS3_NPPL Championship Paintball 2009PS4_Prototype: Biohazard BundlePS3_Chaotic: Shadow WarriorsPS3_Angry Birds TrilogyPS3_Rapala Fishing Frenzy 2009PS3_Bakugan Battle Brawlers: Defenders of the CorePS3_How to Train Your DragonPS3_Ice Age: Dawn of the DinosaursPS3_Cabela's Survival: Shadows of KatmaiPS3_Jurassic: The HuntedPS3_Apache: Air AssaultPS3_Shrek: Forever AfterPS4_Transformer: Rise of the Dark SparkPS3_Cabela's Outdoor Adventures (2009)PS4_Tony Hawk's Pro Skater 5PS3_Spider-Man: Edge of TimePS4_Angry Birds: Star WarsPS3_Madagascar: Escape 2 AfricaPS3_Bakugan: Battle BrawlersPS3_Cabela's Big Game Hunter 2012PS3_X-Men: DestinyPS3_SingularityPS4_Transformers: DevastationPS3_Monster Jam: Path of DestructionPS3_Teenage Mutant Ninja Turtles: Danger of the OozePS3_Spider-Man: Web of ShadowsPS3_Family Guy: Back to the MultiversePS3_Rapala Pro Bass Fishing 2010PS3_NASCAR 2011: The GamePS3_The Amazing Spider-Man 2 (2014)PS3_Skylanders ImaginatorsPS3_Guitar Hero: Van HalenPS3_Tony Hawk: ShredPS3_Angry Birds: Star WarsPS3_Dreamworks Madagascar KartzPS3_Monsters vs. AliensPS3_Cabela's Dangerous Hunts 2011PS3_007 LegendsPS3_Transformers: Dark of the MoonPS3_Enemy Territory: Quake WarsPS3_Guitar Hero: Smash HitsPS4_Destiny 2: ForsakenPS3_Guitar Hero LivePS3_Marvel: Ultimate AlliancePS3_Cabela's Big Game Hunter 2010PS3_Transformers: The GamePS3_Transformers: Fall of CybertronPS4_Skylanders ImaginatorsPS3_Skylanders: SuperChargersPS3_Destiny: The Taken KingPS3_Tony Hawk's Proving GroundPS3_Spider-Man: Shattered DimensionsPS4_Skylanders SWAP ForcePS4_Skylanders: SuperChargersPS4_DeadpoolPS3_DeadpoolPS3_Transformers: War for CybertronPS3_Kung Fu PandaPS4_Skylanders: Trap TeamPS3_The Walking Dead: Survival InstinctPS4_The Amazing Spider-Man 2 (2014)PS4_Call of Duty: Modern Warfare RemasteredPS3_Tony Hawk: RIDEPS3_Guitar Hero: MetallicaPS3_Tony Hawk's Project 8PS3_WolfensteinPS3_Spider-Man 3PS3_Transformers: Revenge of the FallenPS3_Skylanders: Trap TeamPS3_James Bond 007: Blood StonePS3_BlurPS3_Marvel: Ultimate Alliance 2PS3_X-Men Origins: Wolverine - Uncaged EditionPS3_Band HeroPS3_Prototype 2PS3_Goldeneye 007: ReloadedPS3_DJ Hero 2PS4_Destiny: The CollectionPS3_The Amazing Spider-Man (2012)PS3_Guitar Hero: Warriors of RockPS3_DJ HeroPS3_Skylanders: Spyro's AdventurePS3_Guitar Hero: AerosmithPS3_Skylanders GiantsPS3_Skylanders SWAP ForcePS3_Guitar Hero 5PS3_007: Quantum of SolacePS4_Guitar Hero LivePS3_[Prototype]PS3_Call of Duty 3PS3_DestinyPS3_Guitar Hero: World TourPS3_Call of Duty: Black Ops 3PS4_Spyro Reignited TrilogyPS4_Destiny: The Taken KingPS4_Destiny 2PS4_Call of Duty: GhostsPS3_Call of Duty: Advanced WarfarePS4_Crash Bandicoot N. Sane TrilogyPS3_Call of Duty: World at WarPS4_DestinyPS3_Call of Duty 4: Modern WarfarePS4_Call of Duty: Advanced WarfarePS4_Call of Duty: Infinite WarfarePS4_Call of Duty: Black Ops IIIIPS3_Call of Duty: GhostsPS3_Call of Duty: Modern Warfare 2PS3_Call of Duty: Black OpsPS3_Call of Duty: Modern Warfare 3PS4_Call of Duty: WWIIPS3_Call of Duty: Black Ops IIPS4_Call of Duty: Black Ops 3,PS3PS3PS3PS3PS3PS3PS4PS3PS3PS3PS3PS4PS3PS3PS3PS3PS3PS3PS3PS3PS3PS3PS4PS3PS4PS3PS4PS3PS3PS3PS3PS3PS4PS3PS3PS3PS3PS3PS3PS3PS3PS3PS3PS3PS3PS3PS3PS3PS3PS3PS3PS4PS3PS3PS3PS3PS3PS4PS3PS3PS3PS3PS4PS4PS4PS3PS3PS3PS4PS3PS4PS4PS3PS3PS3PS3PS3PS3PS3PS3PS3PS3PS3PS3PS3PS3PS3PS4PS3PS3PS3PS3PS3PS3PS3PS3PS3PS4PS3PS3PS3PS3PS3PS4PS4PS4PS4PS3PS4PS3PS4PS3PS4PS4PS4PS3PS3PS3PS3PS4PS3PS4,Cabela's Adventure CampCall of Duty: Modern Warfare TrilogyTransformers: DevastationTransformer: Rise of the Dark SparkWipeout 2DreamWorks Super Star KartzTeenage Mutant Ninja Turtles: Mutants in ManhattanCabela's North American AdventuresCabela's Dangerous Hunts 2009Soldier of Fortune: PaybackNPPL Championship Paintball 2009Prototype: Biohazard BundleChaotic: Shadow WarriorsAngry Birds TrilogyRapala Fishing Frenzy 2009Bakugan Battle Brawlers: Defenders of the CoreHow to Train Your DragonIce Age: Dawn of the DinosaursCabela's Survival: Shadows of KatmaiJurassic: The HuntedApache: Air AssaultShrek: Forever AfterTransformer: Rise of the Dark SparkCabela's Outdoor Adventures (2009)Tony Hawk's Pro Skater 5Spider-Man: Edge of TimeAngry Birds: Star WarsMadagascar: Escape 2 AfricaBakugan: Battle BrawlersCabela's Big Game Hunter 2012X-Men: DestinySingularityTransformers: DevastationMonster Jam: Path of DestructionTeenage Mutant Ninja Turtles: Danger of the OozeSpider-Man: Web of ShadowsFamily Guy: Back to the MultiverseRapala Pro Bass Fishing 2010NASCAR 2011: The GameThe Amazing Spider-Man 2 (2014)Skylanders ImaginatorsGuitar Hero: Van HalenTony Hawk: ShredAngry Birds: Star WarsDreamworks Madagascar KartzMonsters vs. AliensCabela's Dangerous Hunts 2011007 LegendsTransformers: Dark of the MoonEnemy Territory: Quake WarsGuitar Hero: Smash HitsDestiny 2: ForsakenGuitar Hero LiveMarvel: Ultimate AllianceCabela's Big Game Hunter 2010Transformers: The GameTransformers: Fall of CybertronSkylanders ImaginatorsSkylanders: SuperChargersDestiny: The Taken KingTony Hawk's Proving GroundSpider-Man: Shattered DimensionsSkylanders SWAP ForceSkylanders: SuperChargersDeadpoolDeadpoolTransformers: War for CybertronKung Fu PandaSkylanders: Trap TeamThe Walking Dead: Survival InstinctThe Amazing Spider-Man 2 (2014)Call of Duty: Modern Warfare RemasteredTony Hawk: RIDEGuitar Hero: MetallicaTony Hawk's Project 8WolfensteinSpider-Man 3Transformers: Revenge of the FallenSkylanders: Trap TeamJames Bond 007: Blood StoneBlurMarvel: Ultimate Alliance 2X-Men Origins: Wolverine - Uncaged EditionBand HeroPrototype 2Goldeneye 007: ReloadedDJ Hero 2Destiny: The CollectionThe Amazing Spider-Man (2012)Guitar Hero: Warriors of RockDJ HeroSkylanders: Spyro's AdventureGuitar Hero: AerosmithSkylanders GiantsSkylanders SWAP ForceGuitar Hero 5007: Quantum of SolaceGuitar Hero Live[Prototype]Call of Duty 3DestinyGuitar Hero: World TourCall of Duty: Black Ops 3Spyro Reignited TrilogyDestiny: The Taken KingDestiny 2Call of Duty: GhostsCall of Duty: Advanced WarfareCrash Bandicoot N. Sane TrilogyCall of Duty: World at WarDestinyCall of Duty 4: Modern WarfareCall of Duty: Advanced WarfareCall of Duty: Infinite WarfareCall of Duty: Black Ops IIIICall of Duty: GhostsCall of Duty: Modern Warfare 2Call of Duty: Black OpsCall of Duty: Modern Warfare 3Call of Duty: WWIICall of Duty: Black Ops IICall of Duty: Black Ops 3,ActivisionInfinity WardPlatinumGamesEdge of RealityEndemolActivisionPlatinumGamesActivisionActivisionCauldron Ltd.Sand Grain StudiosActivisionActivisionRovio MobileFUN LabsNow ProductionEtranges LibellulesEurocom Entertainment SoftwareActivisionActivisionGaijin EntertainmentXPEC Entertainment Inc.Edge of RealityActivisionRobomodoBeenoxExient EntertainmentToys for BobMTOActivisionSilicon KnightsRaven SoftwarePlatinumGamesVirtuosWayForward TechnologiesShaba Games / TreyarchHeavy Iron StudiosFUN LabsEutechnyxBeenoxToys for BobNeversoft EntertainmentRobomodoExient EntertainmentSidhe InteractiveBeenoxCauldronEurocomHigh Moon StudiosZ-AxisNeversoft EntertainmentBungieFreeStyleGamesRaven SoftwareCauldronTraveller's TalesHigh Moon StudiosToys for BobVicarious VisionsBungieNeversoft EntertainmentBeenox StudiosUnknownVicarious VisionsHigh Moon StudiosHigh Moon StudiosHigh Moon StudiosLuxofluxToys for BobTerminal RealityBeenoxInfinity WardRobomodo / Buzz Monkey SoftwareNeversoft EntertainmentNeversoft EntertainmentRaven SoftwareTreyarchLuxoflux Corp.Toys for BobBizarre CreationsBizarre CreationsVicarious VisionsRaven SoftwareNeversoft EntertainmentRadical EntertainmentEurocomFreeStyle GamesBungieBeenoxNeversoft EntertainmentFreeStyleGamesToys for BobNeversoftToys for BobUnknownNeversoft EntertainmentTreyarchFreeStyleGamesRadical EntertainmentTreyarchBungieNeversoft EntertainmentTreyarchToys for BobBungieBungieInfinity WardHigh Moon StudiosVicarious VisionsTreyarchBungieInfinity WardSledgehammer GamesInfinity WardTreyarchInfinity WardInfinity WardTreyarchInfinity WardSledgehammer GamesTreyarchTreyarch,0.0,204540000.0,88360000.0,79520000.0,5420000.0,31290000.0,2011-11-012016-05-172015-10-062014-06-242011-10-112011-11-152016-05-242010-09-142008-09-232007-11-142008-11-182016-10-112009-11-172012-09-252008-09-022010-11-022010-03-232009-06-302011-11-012009-11-032010-11-162010-05-182014-06-242009-09-082015-09-292011-10-042013-11-152008-11-042009-10-202011-09-272011-09-272010-06-292015-10-062010-11-092014-10-282008-10-212012-11-202010-09-282011-03-292014-04-292016-10-162009-12-222010-10-262013-10-292009-10-272009-03-242010-10-192012-10-162011-06-142008-05-272009-06-162018-09-042015-10-202006-11-172009-09-292007-06-262012-08-212016-10-162015-09-202015-09-152007-10-152010-09-072013-11-152015-09-202015-11-182013-06-252010-06-222008-06-032014-10-052013-03-192014-04-292017-06-272009-11-172009-03-292006-11-172009-08-182007-05-042009-06-232014-10-052010-11-022010-05-252009-09-152009-05-012009-11-032012-04-242011-11-012010-10-192016-09-192012-06-262010-09-282009-10-272011-10-162008-06-292012-10-212013-10-132009-09-012008-11-042015-10-202009-06-092006-11-152014-09-092008-10-262015-11-062018-11-132015-09-152017-09-062013-11-152014-11-042017-06-302008-11-102014-09-092007-11-052014-11-042016-11-042018-10-122013-11-052009-11-102010-11-092011-11-082017-11-032012-11-132015-11-06,2018-04-152018-12-272018-04-152018-03-162018-04-142018-08-072018-03-302018-04-062018-10-102018-03-172018-03-192018-01-142018-09-142018-03-152018-04-082018-04-202018-04-202018-03-212018-09-232018-01-122018-01-042018-01-142018-11-072017-12-312018-01-14,274.66,28907.0,4651.0,"ArcadeAdventure, ActionPlatformer, Arcade, SportsRacing, ArcadeActionShooter, Action, Simulation, SportsShooter, ActionStrategyAction, PuzzleAction, FightingArcadeArcade, Platformer, Adventure, ActionShooter, ActionShooter, ActionRacing, Arcade, SimulationArcade, SportsActionFamily, Platformer, ArcadeFamily, Arcade, Action, FightingShooter, SportsShooterAdventure, ActionRacing, ArcadeArcadeArcadeShooter, ActionPlatformer, Adventure, ActionArcadeArcade, SportsPlatformer, Family, ActionShooter, Action, SportsShooter, ActionAdventure, ActionShooter, Adventure, ActionArcadeMassively Multiplayer, Shooter, Adventure, ActionArcadeShooter, Action, SportsAction, FightingShooter, ActionPlatformer, Adventure, ActionShooter, Action, RPGSportsActionPlatformer, Adventure, ActionAdventure, ActionAdventure, ActionShooter, ActionAction, Fighting, Arcade, Family, PlatformerShooter, ActionShooter, ActionArcade, SportsArcadeArcade, SportsShooter, ActionAdventure, ActionShooter, ActionShooter, Adventure, ActionRacing, ArcadeArcade, Adventure, Action, RPGArcadeAdventure, ActionShooter, ActionArcadeArcadeArcadeArcadePlatformer, Adventure, ActionPlatformer, Adventure, ActionArcadeArcadeShooterShooter, ActionAdventure, ActionShooter, Action, RPGShooter, ActionShooter, ActionShooter, ActionPlatformer, ActionShooterShooter, ActionShooter, ActionShooter, ActionShooter, ActionShooter, ActionShooterShooter, ActionShooter, ActionShooter, ActionShooter, Action","PlayStation 3, WiiPC, Xbox One, PlayStation 4, Xbox 360, PlayStation 3Nintendo DS, Xbox 360, PlayStation 3, WiiNintendo 3DS, Nintendo DS, PlayStation 3, WiiPC, Xbox One, PlayStation 4, Xbox 360, PlayStation 3Xbox 360, PlayStation 3, PlayStation 2, PSP, WiiPC, Xbox 360, PlayStation 3Nintendo DS, PlayStation 3, WiiNintendo 3DS, Xbox 360, PlayStation 3, PS Vita, Wii U, WiiXbox 360, PlayStation 3, PSPNintendo DS, PlayStation 3, WiiPC, Xbox 360, PlayStation 3, PlayStation 2, WiiXbox 360, PlayStation 3, WiiXbox 360, PlayStation 3, PlayStation 2PC, Xbox 360, PlayStation 3Xbox One, PlayStation 4, Xbox 360, PlayStation 3Nintendo 3DS, Nintendo DS, Xbox 360, PlayStation 3, WiiPC, Xbox 360, PlayStation 3, PlayStation 2, WiiXbox 360, PlayStation 3, PlayStation 2, WiiXbox 360, PlayStation 3, WiiPC, Xbox 360, PlayStation 3PC, Xbox One, PlayStation 4, Xbox 360, PlayStation 3PlayStation 3Xbox 360, PlayStation 3PC, Nintendo DS, Xbox 360, PlayStation 3, PlayStation 2, PSP, WiiPC, Xbox 360, PlayStation 3Xbox One, PlayStation 4, Nintendo Switch, Xbox 360, PlayStation 3, Wii UPlayStation 3, PlayStation 2, WiiPlayStation 3Nintendo DS, Xbox 360, PlayStation 3, PlayStation 2, WiiNintendo DS, Xbox 360, PlayStation 3, WiiPC, Xbox 360, PlayStation 3, Wii UiOS, Nintendo 3DS, Nintendo DS, Xbox 360, PlayStation 3, WiiPC, macOS, Linux, Xbox 360, PlayStation 3PlayStation 3, PlayStation 2, WiiPC, Xbox One, PlayStation 4Xbox One, PlayStation 4, iOS, Xbox 360, PlayStation 3, Wii UXbox 360, PlayStation 3, WiiPC, Nintendo DS, Xbox 360, PlayStation 3, PlayStation 2, PSP, WiiPC, Xbox One, PlayStation 4, Xbox 360, PlayStation 3Xbox One, PlayStation 4, Nintendo Switch, Xbox 360, PlayStation 3, Wii UXbox One, PlayStation 4, Xbox 360, PlayStation 3Nintendo DS, Xbox 360, PlayStation 3, PlayStation 2, WiiPC, Nintendo DS, Xbox 360, PlayStation 3, WiiPlayStation 4, Xbox One, Nintendo 3DS, Xbox 360, PlayStation 3, Wii U, WiiPC, Xbox One, PlayStation 4, Xbox 360, PlayStation 3PC, Xbox One, PlayStation 4, Xbox 360, PlayStation 3PC, Nintendo DS, Xbox 360, PlayStation 3, WiiPC, Nintendo DS, Xbox 360, PlayStation 3, PlayStation 2, WiiPC, Xbox 360, PlayStation 3, Wii UPC, Xbox One, PlayStation 4Xbox 360, PlayStation 3, WiiXbox 360, PlayStation 3, PlayStation 2, WiiXbox 360, Xbox, PlayStation 3, PlayStation 2, PSPPC, Xbox 360, PlayStation 3PC, Xbox 360, PlayStation 3, PlayStation 2, PSP, WiiPC, Xbox 360, PlayStation 3, WiiPC, Xbox 360, PlayStation 3PC, Xbox 360, PlayStation 3PC, Xbox One, PlayStation 4, Nintendo DS, Xbox 360, PlayStation 3, PlayStation 2, PSP, WiiNintendo DS, Xbox 360, PlayStation 3, PlayStation 2, WiiPC, Xbox One, PlayStation 4, Xbox 360, PlayStation 3Xbox 360, PlayStation 3PlayStation 3, WiiXbox 360, PlayStation 3, WiiXbox 360, PlayStation 3, PlayStation 2, WiiPC, Xbox 360, PlayStation 3, PlayStation 2, WiiPC, Nintendo 3DS, Xbox 360, PlayStation 3, Wii U, WiiPlayStation 4, Xbox One, Nintendo 3DS, Xbox 360, PlayStation 3, Wii U, WiiPlayStation 3, PlayStation 2, WiiXbox One, PlayStation 4, iOS, Xbox 360, PlayStation 3, Wii UXbox 360, Xbox, PlayStation 3, PlayStation 2, WiiXbox One, PlayStation 4, Xbox 360, PlayStation 3PC, Xbox One, PlayStation 4, Nintendo SwitchXbox One, PlayStation 4, Xbox 360, PlayStation 3PC, PlayStation 5, Xbox One, PlayStation 4, Xbox Series S/X, WebPC, Xbox One, PlayStation 4, Xbox 360, PlayStation 3, Wii UPC, Xbox One, PlayStation 4, Xbox 360, PlayStation 3PC, Xbox One, PlayStation 4, Nintendo SwitchPC, Xbox One, Nintendo DS, Xbox 360, PlayStation 3, WiiXbox One, PlayStation 4, Xbox 360, PlayStation 3PC, Xbox One, PlayStation 4, Nintendo DS, macOS, Xbox 360, PlayStation 3, WiiPC, Xbox One, PlayStation 4, Xbox 360, PlayStation 3PC, Xbox One, PlayStation 4PC, Xbox One, PlayStation 4, Xbox 360, PlayStation 3, Wii UPC, Xbox One, macOS, Xbox 360, PlayStation 3PC, Xbox One, iOS, Nintendo DS, macOS, Xbox 360, PlayStation 3, WiiPC, Xbox One, iOS, macOS, Xbox 360, PlayStation 3, WiiPC, Xbox One, PlayStation 4PC, Xbox One, Xbox 360, PlayStation 3, Wii U"
PS3_Way of the Samurai 3,PS3,Way of the Samurai 3,Acquire,0.0,520000.0,180000.0,80000.0,220000.0,40000.0,2009-10-13,0,3.33,30.0,56.0,"Adventure, Action","PC, iOS, Xbox 360, PlayStation 3"
