Game,Console,Name,Developer,Total Shipped,Total Sales,NA Sales,PAL Sales,Japan Sales,Other Sales,Release Date,Last Update,rating,ratings_count,metacritic,genres,platforms
PS3_NFL Head Coach 09PS3_NCAA Basketball 09PS3_FaceBreakerPS4_NBA Live 16PS3_NASCAR 08PS3_Grand Slam Tennis 2PS4_NBA Live 18PS3_NASCAR 09PS3_Madden NFL 17PS4_NBA Live 14PS3_NHL 15PS3_EA Sports MMAPS3_Tiger Woods PGA Tour 14PS3_NBA JamPS4_NHL 19PS3_Tiger Woods PGA Tour 07PS4_NHL 17PS3_Madden NFL 07PS3_NBA Live 10PS3_FIFA 18PS3_NHL 14PS3_NHL 10PS4_NHL 18PS3_NHL 12PS3_NCAA Football 09PS3_NHL 11PS4_NHL 15PS3_Tiger Woods PGA Tour 09PS4_NHL 16PS3_2014 FIFA World Cup BrazilPS3_Tiger Woods PGA Tour 10PS3_Madden NFL 16PS3_NCAA Football 10PS3_Tiger Woods PGA Tour 11PS3_NCAA Football 12PS3_NCAA Football 11PS3_Tiger Woods PGA Tour 12: The MastersPS3_NCAA Football 14PS3_SSXPS3_NCAA Football 13PS4_Madden NFL 25PS4_EA Sports UFC 3PS3_Madden NFL 08PS3_Fight Night ChampionPS3_2010 FIFA World Cup South AfricaPS3_FIFA Street (2012)PS4_EA Sports UFC 2PS3_Madden NFL 15PS3_Fight Night Round 4PS3_Fight Night Round 3PS3_FIFA Soccer 08PS3_Madden NFL 09PS3_Skate 3PS4_Madden NFL 19PS4_Madden NFL 15PS3_Madden NFL 12PS3_Madden NFL 10PS3_Madden NFL 11PS3_FIFA 16PS4_Madden NFL 18PS3_Madden NFL 13PS4_Madden NFL 17PS4_Madden NFL 16PS4_FIFA 14PS3_FIFA Soccer 10PS3_FIFA 15PS3_FIFA Soccer 11PS4_FIFA 15PS3_FIFA 14PS3_FIFA Soccer 12PS3_FIFA 13PS4_FIFA 16PS4_FIFA 18,PS3PS3PS3PS4PS3PS3PS4PS3PS3PS4PS3PS3PS3PS3PS4PS3PS4PS3PS3PS3PS3PS3PS4PS3PS3PS3PS4PS3PS4PS3PS3PS3PS3PS3PS3PS3PS3PS3PS3PS3PS4PS4PS3PS3PS3PS3PS4PS3PS3PS3PS3PS3PS3PS4PS4PS3PS3PS3PS3PS4PS3PS4PS4PS4PS3PS3PS3PS4PS3PS3PS3PS4PS4,NFL Head Coach 09NCAA Basketball 09FaceBreakerNBA Live 16NASCAR 08Grand Slam Tennis 2NBA Live 18NASCAR 09Madden NFL 17NBA Live 14NHL 15EA Sports MMATiger Woods PGA Tour 14NBA JamNHL 19Tiger Woods PGA Tour 07NHL 17Madden NFL 07NBA Live 10FIFA 18NHL 14NHL 10NHL 18NHL 12NCAA Football 09NHL 11NHL 15Tiger Woods PGA Tour 09NHL 162014 FIFA World Cup BrazilTiger Woods PGA Tour 10Madden NFL 16NCAA Football 10Tiger Woods PGA Tour 11NCAA Football 12NCAA Football 11Tiger Woods PGA Tour 12: The MastersNCAA Football 14SSXNCAA Football 13Madden NFL 25EA Sports UFC 3Madden NFL 08Fight Night Champion2010 FIFA World Cup South AfricaFIFA Street (2012)EA Sports UFC 2Madden NFL 15Fight Night Round 4Fight Night Round 3FIFA Soccer 08Madden NFL 09Skate 3Madden NFL 19Madden NFL 15Madden NFL 12Madden NFL 10Madden NFL 11FIFA 16Madden NFL 18Madden NFL 13Madden NFL 17Madden NFL 16FIFA 14FIFA Soccer 10FIFA 15FIFA Soccer 11FIFA 15FIFA 14FIFA Soccer 12FIFA 13FIFA 16FIFA 18,EA TiburonEA CanadaEA CanadaEA TiburonEA TiburonEA SportsEA SportsEA TiburonEA TiburonEA TiburonEA CanadaEA TiburonEA TiburonEA TiburonEA CanadaEA Redwood ShoresEA CanadaEA TiburonEA CanadaEA VancouverEA CanadaEA CanadaEA CanadaEA CanadaEA TiburonEA CanadaEA CanadaEA TiburonEA CanadaEA CanadaEA TiburonEA TiburonEA TiburonEA TiburonEA TiburonEA TiburonEA TiburonEA TiburonEA CanadaEA TiburonEA TiburonEA VancouverEA TiburonEA CanadaEA CanadaEA CanadaEA CanadaEA TiburonEA CanadaEA ChicagoEA CanadaEA TiburonEA Black BoxEA TiburonEA TiburonEA TiburonEA TiburonEA TiburonEA CanadaEA TiburonEA TiburonEA TiburonEA TiburonEA CanadaEA CanadaEA CanadaEA CanadaEA CanadaEA CanadaEA CanadaEA CanadaEA CanadaEA Vancouver,0.0,129820000.0,49130000.0,59350000.0,1080000.0,20320000.0,2008-09-032008-11-172008-09-032015-09-292007-07-232012-02-142017-09-152008-06-102016-08-232013-11-152014-09-092010-10-192013-03-262010-11-162018-09-142006-11-142016-09-132006-11-142009-10-062017-09-292013-09-102009-09-152017-09-152011-09-132008-07-152010-09-072014-09-092008-08-262015-09-152014-04-152009-06-082015-08-252009-07-142010-06-082011-07-122010-07-132011-03-292013-07-092012-02-282012-07-102013-11-152018-02-022007-08-142011-03-012010-04-272012-03-132016-03-152014-08-262009-06-232006-12-052007-10-092008-08-122010-05-112018-08-102014-08-262011-08-302009-08-142010-08-102015-09-222017-08-252012-08-282016-08-232015-08-252013-11-152009-10-202014-09-232010-09-282014-09-232013-09-242011-09-272012-09-252015-09-222017-09-29,2018-05-302018-05-302018-10-192018-06-232018-01-102018-01-062018-02-112018-04-202018-02-272018-01-042018-04-032018-04-012018-03-312018-09-152018-03-232018-04-012018-04-02,156.42,5302.0,2725.0,"Simulation, SportsArcade, Fighting, SportsSportsSportsSportsSportsSportsArcade, Fighting, SportsSportsSportsSportsSportsSportsSportsSportsSportsSportsSportsSportsSportsSimulation, SportsSportsSimulation, SportsSportsSportsSportsArcade, SportsSportsSportsSportsSportsFighting, SportsSportsFighting, SportsSportsSportsAction, Fighting, Simulation, SportsSportsArcade, SportsAction, Simulation, SportsSportsSportsSportsSimulation, SportsSportsSportsSportsSportsSportsSportsSportsSportsSportsSports","Xbox 360, PlayStation 3Xbox 360, PlayStation 3Xbox One, PlayStation 4PlayStation 3Xbox 360, PlayStation 3, PlayStation 2Xbox One, PlayStation 4, Xbox 360, PlayStation 3Xbox One, PlayStation 4, Xbox 360, PlayStation 3Xbox 360, PlayStation 3Xbox 360, PlayStation 3Xbox 360, PlayStation 3, WiiXbox 360, PlayStation 3Xbox 360, PlayStation 3Xbox 360, PlayStation 3Xbox 360, PlayStation 3Xbox 360, PlayStation 3, PlayStation 2, PSP, WiiXbox 360, PlayStation 3Xbox One, PlayStation 4, Xbox 360, PlayStation 3Xbox 360, PlayStation 3Xbox 360, PlayStation 3, PlayStation 2Xbox One, PlayStation 4, Xbox 360, PlayStation 3Xbox 360, PlayStation 3, PlayStation 2, PSPXbox 360, PlayStation 3Xbox 360, PlayStation 3Xbox 360, PlayStation 3, PlayStation 2PC, Xbox 360, PlayStation 3Xbox 360, PlayStation 3Xbox 360, PlayStation 3Xbox 360, PlayStation 3Xbox One, PlayStation 4, Xbox 360, PlayStation 3Xbox One, PlayStation 4PC, Nintendo DS, Xbox 360, Xbox, PlayStation 3, PlayStation 2, Wii, GameCubeXbox One, Xbox 360, PlayStation 3PlayStation 3Xbox One, PlayStation 4, iOS, AndroidXbox One, PlayStation 4, Xbox 360, PlayStation 3Xbox 360, PlayStation 3Xbox 360, Xbox, PlayStation 3, PlayStation 2, PSPNintendo DS, Xbox 360, PlayStation 3, PlayStation 2, PSPXbox One, Xbox 360, PlayStation 3PC, Xbox One, PlayStation 4Xbox One, PlayStation 4, Xbox 360, PlayStation 3Xbox 360, PlayStation 3, WiiXbox 360, PlayStation 3, PlayStation 2, WiiXbox 360, PlayStation 3, PlayStation 2, PSP, WiiXbox One, PlayStation 4Xbox 360, PlayStation 3, WiiXbox One, PlayStation 4, Xbox 360, PlayStation 3Xbox One, PlayStation 4, Xbox 360, PlayStation 3PC, PlayStation 4, Xbox One, Nintendo Switch, iOS, Android, Nintendo 3DS, Xbox 360, PlayStation 3, PlayStation 2, PS Vita, PSP, WiiPC, PlayStation 4, Xbox One, Nintendo 3DS, Xbox 360, PlayStation 3, PS VitaPC, PlayStation 4, Xbox One, Nintendo 3DS, Xbox 360, PlayStation 3, PS VitaPC, PlayStation 4, Xbox One, Nintendo Switch, iOS, Android, Nintendo 3DS, Xbox 360, PlayStation 3, PlayStation 2, PS Vita, PSP, WiiPC, iOS, Xbox 360, PlayStation 3, PlayStation 2, Wii UPC, Xbox One, PlayStation 4, Nintendo Switch, Xbox 360"
PS3_NFL TourPS3_FIFA Street 3,PS3PS3,NFL TourFIFA Street 3,EA TiburonEA Canada,0.0,440000.0,180000.0,190000.0,0.0,70000.0,2008-01-082008-02-18,0,3.5,34.0,0.0,Sports,"Nintendo DS, Xbox 360, PlayStation 3"
PS3_Conflict: Denied OpsPS3_Mini NinjasPS3_Kane & Lynch: Dead MenPS3_Tomb Raider: UnderworldPS3_Batman: Arkham Asylum,PS3PS3PS3PS3PS3,Conflict: Denied OpsMini NinjasKane & Lynch: Dead MenTomb Raider: UnderworldBatman: Arkham Asylum,Pivotal GamesIO InteractiveIO InteractiveCrystal DynamicsRocksteady Studios,0.0,6820000.0,3190000.0,2450000.0,130000.0,1060000.0,2008-02-122009-09-082007-11-132008-11-182009-08-25,0,11.600000000000001,3055.0,245.0,"Family, Adventure, ActionAdventure, ActionAction","PC, Nintendo DS, macOS, Xbox 360, PlayStation 3, WiiPC, Nintendo DS, macOS, Xbox 360, PlayStation 3, WiiPC, Xbox One, PlayStation 4, Nintendo Switch, macOS, Xbox 360, PlayStation 3"
PS3_MySims SkyHeroesPS3_Family Game Night 4: The Game ShowPS3_OverstrikePS3_SyndicatePS3_CreatePS3_NBA Street HomecourtPS4_NBA Live 19PS3_G.I. Joe: The Rise of CobraPS3_Harry Potter and the Order of the PhoenixPS3_Hasbro Family Game Night 3PS4_NBA Live 15PS3_NHL 08PS3_Dragon Age Origins: AwakeningPS3_Shadows of the DamnedPS3_Trivial PursuitPS3_The Godfather: Dons EditionPS3_Army of Two: The Devil's CartelPS3_Harry Potter and the Deathly Hallows - Part 2PS3_NCAA Basketball 10PS3_Harry Potter and the Half-Blood PrincePS3_MonopolyPS3_NHL 09PS3_Command & Conquer: Red Alert 3 Ultimate EditionPS3_SkatePS4_Burnout Paradise RemasteredPS3_NCAA Football 08PS3_Monopoly StreetsPS3_Harry Potter and the Deathly Hallows - Part 1PS3_UEFA Euro 2008 Austria-SwitzerlandPS4_Mirror's Edge CatalystPS3_Def Jam IconPS3_Battlefield: HardlinePS3_Mass Effect TrilogyPS4_A Way OutPS3_The SaboteurPS3_NBA Live 09PS3_BulletstormPS4_Rory McIlroy PGA TourPS3_Tiger Woods PGA Tour 13PS3_Alice: Madness ReturnsPS3_Dragon Age: InquisitionPS4_Plants vs. Zombies: Garden Warfare 2PS3_NBA Live 08PS3_Plants vs Zombies: Garden WarfarePS4_Plants vs Zombies: Garden WarfarePS3_NHL 13PS3_Need for Speed: Shift 2 UnleashedPS3_Tiger Woods PGA Tour 08PS3_The Godfather IIPS3_The Lord of the Rings: ConquestPS3_Dragon Age IIPS3_Skate 2PS3_Army of Two: The 40th DayPS3_Kingdoms of Amalur: ReckoningPS3_Mercenaries 2: World in FlamesPS3_The Simpsons GamePS3_Crysis 3PS3_EA Sports Active 2PS3_Brutal LegendPS3_Dead Space 3PS3_The Orange BoxPS3_Dante's InfernoPS4_EA Sports UFCPS3_Mirror's EdgePS3_Army of TwoPS3_Medal of Honor: AirbornePS3_Need for Speed CarbonPS3_Need for Speed RivalsPS3_Crysis 2PS3_Battlefield: Bad CompanyPS3_FIFA 17PS4_The Sims 4PS3_Medal of Honor: WarfighterPS3_Dead Space 2PS3_Mass Effect 2PS3_Mass Effect 3PS4_Mass Effect: AndromedaPS3_Dragon Age: OriginsPS4_Titanfall 2PS3_Burnout ParadisePS3_Dead SpacePS3_Need for Speed: The RunPS3_The Sims 3PS3_Madden NFL 25PS3_Need for Speed: ProStreetPS3_Need for Speed: UndercoverPS4_Battlefield: HardlinePS4_Need for Speed RivalsPS4_Need for Speed: PaybackPS4_Battlefield VPS4_Dragon Age: InquisitionPS3_FIFA Soccer 09PS3_Need for Speed: ShiftPS4_Need for Speed (2015)PS3_Need for Speed: Most Wanted (2012)PS3_Need for Speed: Hot PursuitPS3_Medal of HonorPS3_Battlefield: Bad Company 2PS3_Battlefield 4PS4_Battlefield 4PS4_Star Wars Battlefront II (2017)PS3_Battlefield 3PS4_Battlefield 1PS4_Star Wars Battlefront (2015)PS4_FIFA 19PS4_FIFA 17,PS3PS3PS3PS3PS3PS3PS4PS3PS3PS3PS4PS3PS3PS3PS3PS3PS3PS3PS3PS3PS3PS3PS3PS3PS4PS3PS3PS3PS3PS4PS3PS3PS3PS4PS3PS3PS3PS4PS3PS3PS3PS4PS3PS3PS4PS3PS3PS3PS3PS3PS3PS3PS3PS3PS3PS3PS3PS3PS3PS3PS3PS3PS4PS3PS3PS3PS3PS3PS3PS3PS3PS4PS3PS3PS3PS3PS4PS3PS4PS3PS3PS3PS3PS3PS3PS3PS4PS4PS4PS4PS4PS3PS3PS4PS3PS3PS3PS3PS3PS4PS4PS3PS4PS4PS4PS4,MySims SkyHeroesFamily Game Night 4: The Game ShowOverstrikeSyndicateCreateNBA Street HomecourtNBA Live 19G.I. Joe: The Rise of CobraHarry Potter and the Order of the PhoenixHasbro Family Game Night 3NBA Live 15NHL 08Dragon Age Origins: AwakeningShadows of the DamnedTrivial PursuitThe Godfather: Dons EditionArmy of Two: The Devil's CartelHarry Potter and the Deathly Hallows - Part 2NCAA Basketball 10Harry Potter and the Half-Blood PrinceMonopolyNHL 09Command & Conquer: Red Alert 3 Ultimate EditionSkateBurnout Paradise RemasteredNCAA Football 08Monopoly StreetsHarry Potter and the Deathly Hallows - Part 1UEFA Euro 2008 Austria-SwitzerlandMirror's Edge CatalystDef Jam IconBattlefield: HardlineMass Effect TrilogyA Way OutThe SaboteurNBA Live 09BulletstormRory McIlroy PGA TourTiger Woods PGA Tour 13Alice: Madness ReturnsDragon Age: InquisitionPlants vs. Zombies: Garden Warfare 2NBA Live 08Plants vs Zombies: Garden WarfarePlants vs Zombies: Garden WarfareNHL 13Need for Speed: Shift 2 UnleashedTiger Woods PGA Tour 08The Godfather IIThe Lord of the Rings: ConquestDragon Age IISkate 2Army of Two: The 40th DayKingdoms of Amalur: ReckoningMercenaries 2: World in FlamesThe Simpsons GameCrysis 3EA Sports Active 2Brutal LegendDead Space 3The Orange BoxDante's InfernoEA Sports UFCMirror's EdgeArmy of TwoMedal of Honor: AirborneNeed for Speed CarbonNeed for Speed RivalsCrysis 2Battlefield: Bad CompanyFIFA 17The Sims 4Medal of Honor: WarfighterDead Space 2Mass Effect 2Mass Effect 3Mass Effect: AndromedaDragon Age: OriginsTitanfall 2Burnout ParadiseDead SpaceNeed for Speed: The RunThe Sims 3Madden NFL 25Need for Speed: ProStreetNeed for Speed: UndercoverBattlefield: HardlineNeed for Speed RivalsNeed for Speed: PaybackBattlefield VDragon Age: InquisitionFIFA Soccer 09Need for Speed: ShiftNeed for Speed (2015)Need for Speed: Most Wanted (2012)Need for Speed: Hot PursuitMedal of HonorBattlefield: Bad Company 2Battlefield 4Battlefield 4Star Wars Battlefront II (2017)Battlefield 3Battlefield 1Star Wars Battlefront (2015)FIFA 19FIFA 17,The Sims StudioElectronic ArtsInsomniac GamesElectronic ArtsEA Bright LightEA CanadaEA TiburonDouble Helix GamesEA GamesEA Bright LightEA TiburonEA CanadaBioWare Corp.Grasshopper ManufactureAdrenalin InteractiveElectronic ArtsVisceral GamesEA Bright LightEA CanadaBright Light ProductionsEA Bright LightEA CanadaEA Los AngelesEA Black BoxStellar EntertainmentEA TiburonElectronic ArtsEA Bright LightUnknownEA DICEUnknownEA DICEBioWareHazelightPandemic StudiosEA CanadaPeople Can FlyEA TiburonEA TiburonSpicy HorseBioWare EdmontonPopCap GamesEA CanadaPopCap GamesPopCap GamesEA CanadaSlightly Mad StudiosEA Redwood ShoresEA Redwood ShoresPandemic StudiosBioWare Corp.EA Black BoxEA Montreal38 StudiosPandemic StudiosEA Redwood ShoresCrytekEA VancouverDouble Fine ProductionsVisceral GamesEA UKVisceral GamesEA CanadaEA Digital Illusions CEEA MontrealEA Los AngelesEA Black BoxGhost GamesCrytekEA Digital Illusions CEEA CanadaMaxisDanger Close GamesVisceral GamesBioWare EdmontonBioWareBioWare Corp.BioWare EdmontonRespawn EntertainmentCriterion GamesEA Redwood ShoresEA Black BoxThe Sims StudioEA TiburonEA Black BoxEA VancouverEA DICEGhost GamesGhost GamesEA DICEBioWare EdmontonEA CanadaSlightly Mad StudiosGhost GamesCriterion GamesCriterion GamesEA Los AngelesEA Digital Illusions CEEA DICEEA DICEEA DICEDiceEA DICEEA DICEEA SportsEA Canada,0.0,153650000.0,56070000.0,70000000.0,3830000.0,23690000.0,2010-09-282011-11-012013-05-282012-02-212010-11-162007-03-062018-09-072009-08-042007-06-252010-10-262014-10-282007-09-112010-03-162011-06-212009-03-102007-03-202013-03-262011-07-122009-11-172009-06-302008-10-202008-09-092009-03-232007-09-242018-03-162007-07-172010-10-262010-11-092008-05-192016-06-072007-03-062015-03-172012-12-042018-03-232009-12-082008-10-072011-02-222015-07-142012-03-272011-06-142014-11-182016-02-232007-10-012014-08-192014-08-192012-09-112011-03-292007-08-282009-04-072009-01-132011-03-082009-01-212010-01-122012-02-072008-08-312007-10-302013-02-192010-11-162009-10-132013-02-052007-12-112010-02-092014-06-172008-11-112008-03-072007-11-192006-11-172013-11-192011-03-222008-06-232016-09-272017-11-172012-10-232011-01-252011-01-182012-03-062017-03-212009-11-032016-10-282008-01-222008-10-132011-11-152010-10-262013-08-272007-11-132008-11-172015-03-172013-11-152017-11-102018-11-202014-11-182008-10-142009-09-152015-11-032012-10-302010-11-162010-10-122010-03-022013-10-292013-11-152017-11-172011-10-252016-10-212015-11-172018-09-282016-09-27,2018-06-132018-05-302018-02-242018-09-042018-03-242018-05-242018-05-232018-02-052018-01-052017-12-292018-07-032018-06-292018-04-112018-01-162018-04-042018-12-192019-01-052018-04-032018-01-092017-12-292018-03-242018-03-242018-09-122018-03-28,249.26,46509.0,4893.0,"Family, Arcade, ActionFamily, Arcade, Board GamesSportsSimulation, SportsArcade, Adventure, ActionSportsShooter, ActionFamilySportsAdventure, ActionCasual, Strategy, Family, Board GamesSportsRacing, ArcadeFamily, Board GamesPlatformer, Adventure, ActionShooter, Action, RPGAdventure, ActionShooter, Adventure, ActionShooter, ActionSportsSportsAdventure, ActionStrategy, Action, RPGSportsSportsSportsStrategy, ActionAction, FightingArcade, SportsShooter, Adventure, ActionAdventure, Action, RPGRacing, Shooter, ActionPlatformer, ArcadeStrategy, Shooter, Adventure, ActionSportsStrategy, ActionShooter, ActionShooterAdventure, ActionFighting, Simulation, SportsActionShooter, ActionShooterRacing, ArcadeRacing, ArcadeShooter, ActionShooter, ActionSportsCasual, Strategy, SimulationShooter, ActionShooter, ActionAction, RPGAction, RPGAction, RPGRPGShooter, ActionRacing, ArcadeRacing, ArcadeCasual, SimulationSportsRacing, ArcadeRacing, ArcadeMassively Multiplayer, Shooter, Adventure, ActionStrategy, Action, RPGRacingRacing, ArcadeShooterShooter, ActionShooterShooterShooter, ActionShooter, ActionSimulation, SportsSports","Nintendo DS, Xbox 360, PlayStation 3Xbox 360, PlayStation 3, WiiXbox 360, PlayStation 3Xbox One, PlayStation 4PC, Nintendo DS, Xbox 360, PlayStation 3, PlayStation 2, PSP, Wii, Game Boy Advance, Classic MacintoshPC, Xbox 360, PlayStation 3Xbox 360, PlayStation 3Xbox 360, PlayStation 3, PlayStation 2, WiiXbox 360, PlayStation 3PC, Nintendo DS, macOS, Xbox 360, PlayStation 3, PlayStation 2, PSP, WiiPC, Nintendo Switch, iOS, Android, Xbox 360, PlayStation 3, PlayStation 2, WiiPC, Xbox 360, PlayStation 3, PlayStation 2PC, Xbox One, PlayStation 4, Nintendo SwitchXbox 360, PlayStation 3, WiiPC, Xbox One, PlayStation 4PC, PlayStation 3PC, Xbox One, PlayStation 4PC, Xbox 360, PlayStation 3PC, Xbox One, Xbox 360, PlayStation 3Xbox One, PlayStation 4Xbox 360, PlayStation 3PC, Xbox One, Xbox 360, PlayStation 3PC, Xbox One, PlayStation 4, Xbox 360, PlayStation 3PC, PlayStation 3, PlayStation 2, WiiXbox 360, PlayStation 3PC, Nintendo DS, macOS, Xbox 360, PlayStation 3, PlayStation 2, PSP, WiiPC, Xbox 360, PlayStation 3PC, Nintendo DS, Xbox 360, PlayStation 3Xbox 360, PlayStation 3Xbox 360, PlayStation 3PC, Xbox 360, PlayStation 3PC, Xbox 360, PlayStation 3, PlayStation 2Nintendo DS, Xbox 360, PlayStation 3, PlayStation 2, PSP, WiiPC, Xbox One, Xbox 360, PlayStation 3Xbox 360, PlayStation 3, WiiPC, Xbox One, iOS, macOS, Linux, Xbox 360, PlayStation 3PC, Xbox One, Xbox 360, PlayStation 3PC, macOS, Linux, Xbox 360, PlayStation 3Xbox One, Xbox 360, PlayStation 3Xbox One, PlayStation 4, iOS, AndroidPC, Xbox 360, PlayStation 3Xbox 360, PlayStation 3PC, Xbox One, Xbox 360, PlayStation 3PC, Nintendo DS, Xbox 360, Xbox, PlayStation 3, PlayStation 2, PS Vita, PSP, Wii, GameCube, Game Boy Advance, Classic MacintoshPC, Xbox One, PlayStation 4, Xbox 360, PlayStation 3PC, Xbox 360, PlayStation 3Xbox One, Xbox 360, PlayStation 3PC, Xbox One, PlayStation 4, Xbox 360, PlayStation 3PC, Xbox One, PlayStation 4, Xbox Series S/X, macOSPC, Xbox 360, PlayStation 3PC, Xbox One, Xbox 360, PlayStation 3PC, Xbox One, Xbox 360, PlayStation 3PC, Xbox One, Xbox 360, PlayStation 3, Wii UPC, Xbox One, PlayStation 4PC, Xbox One, macOS, Xbox 360, PlayStation 3PC, Xbox One, PlayStation 4Xbox 360, PlayStation 3PC, Nintendo 3DS, Xbox 360, PlayStation 3, WiiPC, iOS, Nintendo 3DS, Nintendo DS, Xbox 360, PlayStation 3Xbox One, PlayStation 4, Xbox 360, PlayStation 3PC, Nintendo DS, Xbox 360, PlayStation 3, PlayStation 2, PSP, WiiPC, Xbox One, PlayStation 4, Xbox 360, PlayStation 3PC, Xbox One, PlayStation 4PC, Xbox One, PlayStation 4, Xbox 360, PlayStation 3PC, Android, Xbox 360, PlayStation 3, PSPPC, Nintendo Switch, iOS, Android, Xbox 360, PlayStation 3, WiiPC, Xbox 360, PlayStation 3PC, Xbox One, Xbox 360, PlayStation 3PC, Xbox One, PlayStation 4, Xbox 360, PlayStation 3PC, Xbox One, PlayStation 4, Xbox 360, PlayStation 3PC, Xbox One, Xbox 360, PlayStation 3PC, Xbox One, PlayStation 4PC, Xbox One, PlayStation 4, Nintendo Switch, Xbox 360, PlayStation 3PC, Xbox One, PlayStation 4, Xbox 360, PlayStation 3"
PS4_Call of CthulhuPS4_The SurgePS4_Bound By FlamePS3_The Testament of Sherlock HolmesPS4_Spintires: MudRunnerPS4_Sherlock Holmes: Crimes & PunishmentsPS4_Divinity: Original SinPS4_VampyrPS4_Farming Simulator 2015PS3_Farming Simulator 2015PS4_Farming Simulator 19PS4_Farming Simulator 17,PS4PS4PS4PS3PS4PS4PS4PS4PS4PS3PS4PS4,Call of CthulhuThe SurgeBound By FlameThe Testament of Sherlock HolmesSpintires: MudRunnerSherlock Holmes: Crimes & PunishmentsDivinity: Original SinVampyrFarming Simulator 2015Farming Simulator 2015Farming Simulator 19Farming Simulator 17,CyanideDECK13 InteractiveSpidersFrogwaresSaber InteractiveFrogwaresLarian StudiosDONTNOD EntertainmentGiants SoftwareGiants SoftwareGiants SoftwareGiants Software,0.0,4190000.0,1310000.0,2150000.0,60000.0,680000.0,2018-10-302017-05-162014-05-072012-09-302017-10-312014-09-302015-10-272018-06-052015-05-192015-05-192018-11-202016-10-25,2019-03-232018-01-062018-10-312018-05-302018-04-182018-02-082018-04-112018-12-192018-04-06,31.78,3378.0,565.0,"Adventure, Action, RPGAction, RPGAction, RPGAdventure, ActionRacingStrategy, Indie, RPGAdventure, Action, RPGFamily, SimulationSimulation","PC, Xbox One, PlayStation 4, Nintendo SwitchPC, Xbox One, PlayStation 4PC, Xbox One, PlayStation 4, Linux, Xbox 360, PlayStation 3PC, Xbox 360, PlayStation 3PC, Xbox One, PlayStation 4PC, Xbox One, PlayStation 4, macOSPC, Xbox One, PlayStation 4, Nintendo SwitchPC, Xbox One, PlayStation 4, macOSPC, Xbox One, PlayStation 4, iOS, macOS"
PS4_Elite: DangerousPS4_Jurassic World Evolution,PS4PS4,Elite: DangerousJurassic World Evolution,Frontier DevelopmentsFrontier Developments,0.0,660000.0,200000.0,350000.0,0.0,110000.0,2017-06-272018-07-03,2018-06-152018-04-20,3.61,341.0,71.0,"Strategy, Action, Simulation","PC, Xbox One, PlayStation 4, Nintendo Switch"
PS4_The Invisible Hours,PS4,The Invisible Hours,Tequila Works,0.0,110000.0,90000.0,0.0,0.0,20000.0,2017-10-10,2018-09-17,4.05,19.0,76.0,"Casual, Adventure","PC, Xbox One, PlayStation 4"
PS3_Legendary,PS3,Legendary,Spark Unlimited,0.0,130000.0,80000.0,30000.0,0.0,20000.0,2008-10-31,0,2.76,123.0,50.0,"Shooter, Action","PC, Xbox 360, PlayStation 3"
PS4_SubnauticaPS4_Bulletstorm: Full Clip EditionPS4_We Happy FewPS4_Hello NeighborPS4_Fortnite,PS4PS4PS4PS4PS4,SubnauticaBulletstorm: Full Clip EditionWe Happy FewHello NeighborFortnite,Unknown Worlds EntertainmentPeople Can FlyCompulsion GamesDynamic PixelsEpic Games,0.0,1630000.0,750000.0,610000.0,0.0,270000.0,2018-12-042017-04-072018-08-102018-07-272017-07-21,2018-07-162018-06-252018-09-172018-11-062018-06-19,14.18,2613.0,263.0,"Indie, AdventureAdventure, ActionIndie, Adventure, ActionAdventure, Action, Puzzle, Strategy, Indie","PC, PlayStation 5, Xbox One, PlayStation 4, Xbox Series S/X, Nintendo Switch, macOSPC, Xbox One, PlayStation 4, Nintendo SwitchPC, Xbox One, PlayStation 4PC, Xbox One, PlayStation 4, Nintendo Switch, iOS, Android"
PS4_RiME,PS4,RiME,Tequila Works,0.0,110000.0,20000.0,70000.0,0.0,20000.0,2017-05-26,2018-04-08,3.67,780.0,78.0,"Adventure, Puzzle","PC, Xbox One, PlayStation 4, Nintendo Switch"
PS4_Friday the 13th: The Game,PS4,Friday the 13th: The Game,IllFonic,0.0,480000.0,290000.0,90000.0,30000.0,80000.0,2017-10-13,2018-05-30,3.12,325.0,61.0,"Adventure, Action","PC, Xbox One, PlayStation 4, Nintendo Switch"
PS4_Rock Band 4,PS4,Rock Band 4,Harmonix Music Systems,0.0,570000.0,410000.0,60000.0,0.0,100000.0,2015-10-06,2018-05-23,4.2,84.0,0.0,Simulation,"Xbox One, PlayStation 4"
PS4_No Man's Sky,PS4,No Man's Sky,Hello Games,0.0,2260000.0,890000.0,970000.0,40000.0,370000.0,2016-08-09,2018-04-04,3.71,1565.0,75.0,"Adventure, Action, RPG, Simulation, Indie, Massively Multiplayer","PC, PlayStation 5, Xbox One, PlayStation 4, Nintendo Switch"
PS4_Fairy Fencer F: Advent Dark ForcePS4_Cyberdimension Neptunia: 4 Goddesses Online,PS4PS4,Fairy Fencer F: Advent Dark ForceCyberdimension Neptunia: 4 Goddesses Online,Compile HeartCompile Heart,0.0,280000.0,120000.0,0.0,130000.0,20000.0,2016-07-262017-10-10,2018-07-032018-07-04,6.85,53.0,0.0,"Adventure, RPGAction, RPG","PC, PlayStation 4, Nintendo SwitchPC, PlayStation 4"
PS3_The King of Fighters XIIPS3_El Shaddai: Ascension of the Metatron,PS3PS3,The King of Fighters XIIEl Shaddai: Ascension of the Metatron,SNK Playmore CorporationIgnition Entertainment,0.0,440000.0,220000.0,80000.0,110000.0,40000.0,2009-07-282011-08-16,0,7.27,51.0,76.0,"Arcade, FightingAdventure, Action","Xbox 360, PlayStation 3PC, Nintendo Switch, Xbox 360, PlayStation 3"
PS4_Song of the Deep,PS4,Song of the Deep,Insomniac Games,0.0,150000.0,120000.0,0.0,0.0,30000.0,2016-07-12,0,3.37,52.0,71.0,"Adventure, Action","PC, Xbox One, PlayStation 4"
PS3_Bladestorm: The Hundred Years' WarPS3_Dynasty Warriors 6 EmpiresPS3_Dynasty Warriors 6,PS3PS3PS3,Bladestorm: The Hundred Years' WarDynasty Warriors 6 EmpiresDynasty Warriors 6,Omega ForceOmega ForceOmega Force,0.0,1330000.0,420000.0,130000.0,700000.0,80000.0,2007-11-062009-06-232008-02-19,0,3.57,44.0,60.0,"Strategy, ActionAction","Xbox 360, PlayStation 3PC, Xbox 360, PlayStation 3, PlayStation 2, PSP"
PS3_Air Conflicts: Secret Wars,PS3,Air Conflicts: Secret Wars,Games Farm,0.0,190000.0,100000.0,60000.0,0.0,30000.0,2011-11-01,0,2.67,12.0,65.0,"Shooter, Action, Simulation","PC, Nintendo Switch, Xbox 360, PlayStation 3"
PS4_Tropico 5,PS4,Tropico 5,Haemimont Games,0.0,380000.0,70000.0,180000.0,80000.0,50000.0,2015-04-28,2018-08-20,3.64,541.0,75.0,"Strategy, RPG, Simulation","PC, PlayStation 4, macOS, Linux, Xbox 360"
PS4_MotoGP 17PS4_Cities: Skylines,PS4PS4,MotoGP 17Cities: Skylines,Milestone S.r.l.Colossal Order,0.0,440000.0,190000.0,140000.0,40000.0,70000.0,2017-07-112017-08-15,2018-06-252018-04-22,6.92,1535.0,85.0,"Racing, Simulation, SportsStrategy, Simulation","PC, Xbox One, PlayStation 4PC, Xbox One, PlayStation 4, Nintendo Switch, macOS, Linux"
PS4_Attack on Titan 2PS4_Warriors Orochi 4,PS4PS4,Attack on Titan 2Warriors Orochi 4,Omega ForceOmega Force,0.0,440000.0,140000.0,40000.0,220000.0,40000.0,2018-03-202018-10-16,2018-03-302018-11-11,7.6,89.0,75.0,ActionAction,"PC, Xbox One, PlayStation 4, Nintendo Switch, PS VitaPC, Xbox One, PlayStation 4, Nintendo Switch"
